issuekey,title,description,storypoint,split_mark
DURACLOUD-332,Duplicate on Change: space access is not propagated,"this item is to address the issue of the duplicateondemand service not updating access state on the secondary provider when a space at the primary provider is changed from open to closed, or vice versa. scenario: # deploy the duplicateondemand service # create a space in the primary store # verify that the space was also created in the secondary store # verify that both spaces have the same access state # toggle the access state of the primary space # boom!, notice the access state of the secondary space did not change",1,train
DURACLOUD-333,Changing space access removes the space metadata,when changing the access level of a space the space metadata is removed.  create a space add space metadata change the space access refresh the space notice the space metadata is gone,1,train
DURACLOUD-335,Media streamer: files not getting set with proper permissions,"on occasion, when starting the media streamer service, one or several of the files to be streamed is not set to have the proper permissions for streaming. thus far, this issue has always been resolved by restarting the media streamer. it seems likely that the missing permission is due to a failed call to s3, so a retry would likely fix the problem.",1,train
DURACLOUD-338,Chunker Tool: error pushing files in sub-directories on Windows,"when running the chunker tool on windows, if the content directory includes subdirectories with files, the tool will attempt to send each file to duracloud with a name ""subdirname\filename"", which causes an error because the ""\"" character cannot be part of a content id. this does not show up on linux/mac systems because the ""/"" is used instead. this task is to update the chunker tool to replace ""\"" characters with ""/"" characters in all generated content ids.",1,train
DURACLOUD-339,DurAdmin: Errors on space filter,"when attempting to filter by name in a space (used the xservicework dir as an example, need this features to get logs for a specific bulk run), i tend to get ""next page failed: error"" and ""get space failed: error"" pop ups. the filter works and loads the list of filtered content items correctly, so the errors seem unnecessary.  it appears that a new attempts is made to get the content listing on every change to the filter box, so each letter i type creates a new call.  my guess is that just adding a ""filter"" button beside the text box, and only making the call when the button is pressed would fix the issue.",1,train
DURACLOUD-341,Duplication on Demand destination space,"when configuring the duplication on demand service, if you leave the destination space name blank, the service should automatically create the destination space with the source space's name.  carissa ran the service leaving the destination space blank (assuming this would occur) and the service ran to completion... service status read: ""complete"" but no duplicated content was to be found.",1,train
DURACLOUD-342,Bulk Image Transformer output to be standard CSV format,"currently the output for the bulk image transformer is in a modified csv format, similar to: name1=value1, name2=value2, name3=value3, ...  this task is to update the output to be in standard csv format: value1, value2, value3  the first line in the file should a header which indicates the names of the values to follow: name1, name2, name3  the bulk bit integrity service produces this format by allowing the hadoop reducer to produce all of the value lines, then using a post processor to insert the name line at the top.",2,train
DURACLOUD-344,Consistency of service output destinations and names,"this improvement is to ensure that all reportlike outputs from services are created in the xserviceout space. also, the outputs should have a consistent naming convention: / where / = all lowercase with ' ' between words if necessary",4,train
DURACLOUD-346,Refactor integration tests that regularly fail,"this task is to determine the integration tests that regularly fail due to ""eventual consistency"" effects or other issues related to the underlying storage provider implementations.  eventually these tests should either be refactored to be more resistant to underlying storage issues, or should be refactored into unit tests that do not require network connectivity. however, this refactoring work will be addressed in a separate task. https:/jira.duraspace.org/browse/duracloud 237",5,train
DURACLOUD-347,Hashed user credentials,"this improvement is to change from the current pattern of storing user credentials inmemory as plain text to, storing the hash of the credentials inmemory and having authn perform the same hashing (sha256?). see spring security for adding a ""password encoder"" to authentication providers in both 2.x and 3.x versions.",5,train
DURACLOUD-348,Bulk service status message,"this improvement is to more accurately display the service status state of bulk services. currently, bulk image conversion and bulk bit integrity checking are processed in two steps: 1. hadoop processing 2. post processing on duracloud instance  the service status shows conflicting messages. the ""job state"" is ""complete"" when the hadoop step is done, but the ""service status"" shows ""post job processing"" for bit integrity, and nothing for image conversion.  more accurate and consistent status messages need to be put in place across the services.",2,train
DURACLOUD-349,Bit Integrity Service: iterating over http stream,"this issue is to change the listingiterator found in hashfinderworkload.java to iterate over a cached file inputstream rather than the content inputstream from an http get. although in most scenarios this is not an issue, when the content stream is large (30,000+ lines) the http stream sometimes breaks, causing the iteration to stop.",1,train
DURACLOUD-351,Allow build-time specification of dependency osgi bundle version,this improvement is to allow services built within a particular version of the baseline (say 1.4.0) to specify compatibility with dependency duracloud osgi bundles from another version (say 1.3.0).,1,train
DURACLOUD-352,Bit Integrity Service: Support comparison for space manifests of up to 1 million items,this improvement is to ensure that spaces that contain up to 1 million items can successfully perform a bit integrity manifest verification.,2,train
DURACLOUD-353,Bulk Bit Integrity Service: shutdown of post-processor,"this item is to address the issue of shutting down not only the bulk bit integrity service on ""undeploy"", but also shutting down the post processor.  to reproduce this error, start the bbis over a space containing more than 1000 items. once the ""job state"" indicates ""complete"", but while the ""service status"" still indicates ""post job processing..."", undeploy the service. undeploy fails due to the inability to remove the fixityservice osgi bundle from the services container, as it is still processing. at this point, the bbis remains in duraservice, but is no longer available via servicesadmin.",2,train
DURACLOUD-354,Bulk Image Conversion: failure due to Hadoop AMI upgrade,this item is to address the breakage caused by amazon elasticmapreduce changing their default ami for hadoop jobs. this effects the bulk image conversion service which is faulting in the bootstrap script due to a missing dependency in the apt get initialization. ,1,train
DURACLOUD-355,Media Streamer: Allow streaming of multiple spaces,this task is to allow the user to select multiple spaces for the media streaming service to stream.,2,train
DURACLOUD-356,Synctool: selective sync-ing,"this improvement should allow the user to selectively sync specific files based on subdirectories, prefixes, and/or suffixes using the synctool.",3,train
DURACLOUD-357,Media Streamer: Stream files added to a space,"this task is to set up a listener for new files which are added to spaces on which streaming is already enabled, and enable those files for streaming as well.",4,train
DURACLOUD-358,Revisit build from source,it appears that an oc4j dependency used by pax construct is no longer available in a public m2 repository. this task should revisit pax to see if an upgrade is in order and to ensure that the build works from scratch.,5,train
DURACLOUD-364,Single Use Access URLs,"this task is to allow for the creation of single use access urls. the user would need to specify the file which they would like to provide access to, then duracloud would provide a link by which that file can be accessed a single time. after the url is used once, it no longer allows access to the file.",5,train
DURACLOUD-365,service reports contain another differentiator,service reports that appear in the service output space need to have an additional differentiator so that services that are run multiple times in one day do not overwrite one another.,4,train
DURACLOUD-369,Bulk Bit Integrity Service: post-processing in hadoop,"this improvement is to change the bulk bit integrity service to run its md5 metadata collection post processor in hadoop instead of with a single process on the main duracloud instance. this enables the service to run within hours instead of days for spaces exceeding 50,000 items.",3,train
DURACLOUD-370,Notification/Email utility,this feature is to expose a utility for sending emails. it should consist of both a general interface project and a corresponding implementation project.,2,train
DURACLOUD-371,Remove interim bulk-bit-integrity manifests,this improvement is to remove from the service output space the interim manifests that the bulkbitintegrity service creates once the final report has been created. these manifests are: bitintegritymetadataresults.csv bitintegrity results.csv,3,train
DURACLOUD-374,Service Report: backend utility for currently running services,provide a way to generate a report containing:  details from running services  the details should include at least the following information:   tbd  the reports should also be available for retrieval through a rest api,5,train
DURACLOUD-375,Storage Report Dashboard,"this task is to create a ui dashboard for displaying and downloading reports on storage.  rest api calls should be available from which the storage report information can be gathered. a ui will need to be created to be able to display the information in the reports.  the reports will likely be in xml, so xslt is an option for display.",5,train
DURACLOUD-376,Limit time that can be spent spinning on a mapper task within hadoop,"currently, the service code which runs in hadoop kicks off a thread to ensure that the mapper has enough time to complete. these threads are not time limited, so if the mapper process hangs, the hadoop job could potentially live forever. this task is to revisit these threads for each of the bulk jobs to set a limit for the amount of time the threads give to a mapper activity.",2,train
DURACLOUD-377,Remove user management from Duradmin,"this task is to remove the usermanagement capabilities (""adminstration"" tab) from duradmin, since this functionality is being moved up the the accountmanagement app.",1,train
DURACLOUD-379,Run-away service monitor,this task is to create a script/application that monitors duracloud accounts for long running bulk services and sends an email alert upon detection.,1,train
DURACLOUD-380,Azure Storage Provider - adding content and specifying a checksum,"when a checksum is provided upon adding content to azure, checksuminputstream was incorrectly trying to calculate the checksum from the provided stream.  the provided checksum should be used instead of calculating it from the stream.",1,train
DURACLOUD-381,DuraCloud instance losing initialization information,"1. restart a duracloud instance via the amazon management console 2. wait 5 minutes 3. run appconfig to initialize the instance 4. check the instance, everything looks good 5. wait between 710 min, check again   this time none of the users that were in the init are in duradmin or duraservice  after all of these steps, if you log in to duradmin as root, you will see on the admin tab that no users are listed, and going to the services tab brings up a ""get available services failed: error"" dialog. you will also not be able to log in to duradmin as any user besides root. interestingly, everything seems normal on the spaces tab, and rest calls to durastore work fine.  as a secondary issue, if on step 2 you don't wait 5 minutes, but go ahead when each of duradmin/durastore/duraservice are available (less than 2 min after restart), then in a short amount of time after you init, (less than 2 min) the durastore and duraservice init go away. but in this case all of the users are still present.",5,train
DURACLOUD-382,Create Example ServiceClient,this task is to create a sample serviceclient analogous to the sample storeclient.,1,train
DURACLOUD-383,Bit Integrity Service: support retries of interrupted content downloads,this task is to add retries to the bitintegrityservice when a content item that is downloaded to calculate its md5 does not match the expected md5 from metadata.,1,train
DURACLOUD-384,Bit Integrity Service: Pass into comparison phase content-id of csv input,"the comparison phase of an 'allinoneforspace' run of the bitintegrityservice tries to guess the contentid of the input csv files. with date/timestamps appended to the contentids, this becomes difficult. therefore, the input content ids should be passed into the comparison phase.",1,train
DURACLOUD-385,Image Viewing URL Stability,"this task is to investigate the stability of image viewing urls across upgrades of duracloud instances. as each duracloud instance has an allocated static i.p. address, the behavior is unexpected. if there are specific uses cases for demonstrating this issue, please add them as comments below.",2,train
DURACLOUD-387,Error on large space delete,"this item is to resolve issues seen when trying to delete a large space  on the rackspace storage provider: in the bhl.duracloud.org instance, there is a space ""masterrack"" that initially contained 26,000 items. deleting single items or a page of 200 items succeeded; however, when trying to delete the entire space a popup pops after a few minutes indicating that the operation failed. after one attempt, the number of items dropped to: 25,295 after another attempt, before failing the number of items dropped to: 24,727 in looking at the logs on the instance, it appears that two different types of errors were occurring, both of which were coming from rackspace:  could not connect to rackspace due to error: read timed out  object was not found reportofscientif03scotrich/reportofscientif03scotrich_metasource.xml (other contentitems also reported as unfound)  see attached catalina.out for details.  on the s3 storage provider: in the bill.duracloud.org instance, there was a space ""numfilestestwork 3"" that initially contained 36,845 items clicking on ""delete space"" in duradmin started it spinning for about 5 minutes, it then came back with a dialog saying ""failed to delete space"". checking on the space size after the dialog popped up showed it at 31,000 items however, even with duradmin out of the loop, the size of the space continued to drop and the space was eventually deleted, after about 35 minutes there were no errors in the logs indicating a failure.",5,train
DURACLOUD-389,Service Registry Naming,this update is needed to support creating a serviceconfig.xml document that is named the same as the allowable service registry name. the old convention was: duracloud0.9.0servicerepo the new convention is: duracloud090service repo ,1,train
DURACLOUD-390,Security over UserDetailsService.getUsers(),this improvement is to add method security over userdetailsservice.getusers() to limit access to this call to role_admin.,1,train
DURACLOUD-392,Create installation package for release,"such an installation package should include:  documentation  the three wars (duradmin, duraservice, durastore)  zip of service registry  zip of osgi container",1,train
DURACLOUD-394,Page load latency,"the duradmin pages are built using jquery. when the browser loads, the scripts pull data while building the page, creating a perceptible delay in rendering. a recommended solution may be to pull some of the jquery back and not try to build the screen using as much scripting.  browser versions and usage scenarios need to be added to this jira item.",2,train
DURACLOUD-397,Metadata editor allows for blank values,"metadata editing via duradmin (using both the regular editor and the ""edit metadata"" dialog) allows you to add empty name/value pairs to the metadata list. metadata names should be required. although the ui appears to allow empty metadata name/values, if the name is empty, the metadata does not persist.",1,train
DURACLOUD-398,UI shortcuts which are not useful should be disabled,holding shift + one of the arrow keys does odd things to the display. these shortcuts should be disabled.,1,train
DURACLOUD-399,Allow user to select which spaces to include when running Duplicate on Change,"this task is to provide the option for users to select a list of spaces when configuring the duplicate on change service, then only perform duplications for items in those spaces. one reason for this feature is to allow users to choose to not duplicate xserviceout and xservicework spaces.",3,train
DURACLOUD-400,DuraStore REST API: text/plain response from getSpaces,"just an inconsistency i noticed while looking at the rest api. this particular method gives a response contenttype header of ""text/plain"". most other methods that return xml declare their contenttype as text/xml.  for example:  https:/demo.duracloud.org/durastore/spaces?storeid=0  ...gives text/plain, but:  https:/demo.duracloud.org/durastore/cwilper test?storeid=0  ...gives text/xml.",1,train
DURACLOUD-401,Use application/xml as response Content-Type for XML-returning REST API methods,"most of the rest api methods that return xml today use text/xml, but application/xml is a actually a better choice due to character encoding issues:  according to the specification of the text/ media types (rfc2046), if a charset parameter is not specified in the declaration of mime type (at the end of the contenttype value, ala ""text/xml; charset=utf8"", it must be assumed that the body is encoded in usascii.  the ""encoding"" declared in the xml declaration is supposed to be ignored.  here are a couple online posts that further explain the problem:    http:/annevankesteren.nl/2005/03/textxml    http:/  it's clearly the intent that duracloud rest api methods that return xml are encoded in utf8 (because the xml declaration says so), but according to the standards, because text/xml is used instead of application/xml, and the contenttype is not declared with a ""charset=utf8"" mime parameter, the xml declaration is supposed to be ignored by clients and they should assume usascii.",1,train
DURACLOUD-402,Allow for local service repository,it is currently required that the service repository for a duracloud instance be hosted on another duracloud instance. this task is to allow the service repository to be hosted within the same instance. this will both simplify the deployment of stand alone duracloud instances (for users of the open source platform) and lead the way toward allowing multiple service repositories to be associated with a single instance.,1,train
DURACLOUD-403,Improve binary installation package,"in the 0.9 release the first binary installation package was created. this allows system admins to deploy an instance of duracloud without needing to build from source. this was a good first step, but there are a few pieces which could make the process smoother:   include wars with names that do not include version. when the jars are dropped into tomcat with the release version included in the file name, they are not deployed to the expected context path (i.e. rather than a context path of /durastore it is instead /durastore/. the installation package zip file includes the version number, this should be sufficient.  include the appconfig jar, as this is needed to configure the instance.  include an example properties file to be used with appconfig.jar for instance initialization.  include a default/example logback.xml file which can be used within the service bundle home.  update included run.bat file to properly pick up environment variables in a windows environment  allow for the use of a local service repository (handled by duracloud402)   update the included readme.txt file to have complete instructions for standing up a duracloud instance using the files provided with the installation package. parts of this document can refer to the wiki for further explanation, but ideally, the entire process would be well enough defined in the readme such that the links to the wiki would be optional reading.",1,train
DURACLOUD-404,Duraservice: clean re-initialization,"currently, when reinitializing duraservice, due to caching, some elements do not take on the new reinitialize values. this improvement is to determine and implement what is required to make duraservice re initialization work as if it were being initialized from scratch.",1,train
DURACLOUD-406,"Service.xml: generate on build, not on test",this improvement is to have the services.xml service repo manifest created during the mvn 'package' phase instead of during 'test'.,1,train
DURACLOUD-407,Service.xml: generate various renditions,this feature is to have the services.xml servicerepo manifest generated for each of the various duracloud account package types:  archiving / preservation  media access  professional   trial,1,train
DURACLOUD-408,Host DuraCloud maven artifacts with Sonatype,this item includes the following tasks:   open ticket with sonatype for org.duracloud  check if deps are outside of central  check dep licenses  make sure our poms are of good quality (sonatype oss)  the following plugin will be useful. mvn dependency:tree  https:/docs.sonatype.org/display/repository/sonatypeossmavenrepositoryusage+guide ,5,train
DURACLOUD-409,Failed to copy all files when running a large Duplicate-on-Demand service,"a small percentage of files are not copied during the execution of a large duplicate on demand service execution.  this can result in either a missing file or a zero length file in the target space.  this has bug has been demonstrated repeatedly both between different providers and copies back to the same provider.  however, it has only been observed in large file sets (circa 70,000).",16,train
DURACLOUD-410,Use Amazon multi-part upload for large files,"this task is to update the s3storageprovider to make use of amazon's multipart upload option for s3 when content is large enough to require chunking. this would mean that rather than storing our chunked file parts (and associated manifest) in s3, we would use the multipart tools to push up the pieces and assemble them again in s3.  since the md5 for the entire chunked file is not available from s3, we will need to calculate it on transfer and store it as metadata.",5,train
DURACLOUD-416,Implement a content cache to mitigate eventual consistency issues,"in order to make the issues of eventual consistency an issue that does not concern the users of duracloud, durastore should be updated to provide a cache for the content which is stored. this could mean either storing the file locally first, then making the call to push it to the provider, or wrapping the stream in order to write the file locally while it is being stored at the provider. these local files would be used to fulfill get requests that come in shortly after the file has been stored. the files in the cache would be removed once there is a greater degree of certainty that the file will be available on all following requests to the provider (perhaps just after a certain time period has elapsed.)  note that one benefit to storing the files locally prior to pushing them to the provider would be that we could know the file size and generate the checksum locally before making the provider request, meaning that we could ensure that the file reached durastore correctly before passing it along to the next location. this may also become useful for handling large files that we intend to pass to the provider using a multi part upload.",5,train
DURACLOUD-420,Create 1.0.0 AMI,updates to the 1.0.0 ami should include:  trim down apache rules to only expect j2k to be running on port 18080   add utf8 support to tomcat connectors / /   add debug tomcat startup script ,1,train
DURACLOUD-423,Filter display of service properties,"this feature is to omit the rendering of service properties that have names prefixed with ""system "". these are service properties that are useful for monitoring and scripting, but are probably confusing for end users of duradmin.",1,train
DURACLOUD-424,Service completion state must be accurate: non-bulk services,"this improvement is to reflect the completion state of nonbulk services as ""success"" or ""failure"". currently, the service state remains ""started"".  affected services: bit integrity checker bit integrity checker tools image transformer  additionally, the endtime of the service should be captured in the service properties.",3,train
DURACLOUD-425,Service completion state must be accurate: bulk services ,"this improvement is to reflect the completion state of bulk services as ""success"" or ""failure"". currently, the service state remains ""started"".  affected services: bit integrity checker bulk image transformer bulk duplicate on demand  additionally, the end time of the service should be captured in the service properties.",2,train
