issuekey,title,description,storypoint,split_mark
DURACLOUD-759,Sync Tool: Hidden password option,"this task is to provide an option for the sync tool which will allow users to supply their duracloud password in a way other than via the command line options. the reason this is an issue, is because the full command used to run the sync tool remains available in the process list of the machine on which the sync tool is running.  the suggested fix for this concern is to allow users to define an environment variable which contains their duracloud password, which would be picked up by the sync tool if the  p option is not provided. ",1,val
DURACLOUD-760,Make use of durable subscriptions for messaging connections,"this task is to introduce the use of durable subscriptions in place of standard topic subscriptions in order to have a better assurance that messages are not lost in the event of an interruption of a jms connection. the failover directive, which is currently in use, allows connections to be reestablished, but there is the potential for messages which were sent during the time when the connection was down to be missed.  more information can be found here: http:/activemq.apache.org/howdodurablequeuesandtopicswork.html http:/activemq.apache.org/managedurable subscribers.html",2,val
DURACLOUD-761,Auditor not receiving messages,"the auditor, as well as the service reporter (both part of duraboss), are not receiving messages in 2.1.1 instances.",2,val
DURACLOUD-763,Notification email address validation needs work,"as reported by dan galewsky, the regex being used to validate the from email address in duraboss (which is used to send notification emails on events) does not properly handle all valid email addresses. in particular, the example provided is that setting this value in init.properties:  duraboss.notification.0.originator=user@austin.utexas.edu  causes this error  fromaddress not valid notification: user@austin.utexas.edu  the issue is that the regular expression used in amazonnotificationfactory.java fails on some valid email addresses, like the one above.",1,val
DURACLOUD-764,Ability to easily share links to DuraCloud content,"there should be a simple way to share content that is stored in duracloud. something like a ""share"" button/feature for spaces/content items that are stored in duracloud would likely work. initially, this could just be for content in open spaces. this would keep users from having to manually find the storage url for a content item and then find a way to share it. instead, the user could be presented with a pop up window that could be configured to send an email or, perhaps, generate some embeddable html code.  this feature would make duracloud a convenient platform for sharing large files that were otherwise difficult to share, as they are too large to email or pass around via im.  this feature would be notionally very similar to dropbox links (https:/  ",2,val
DURACLOUD-766,SyncTool error,"this issue was reported by bryan beecher on dec 20, 2012. he was, at the time, using the latest sync tool from trunk:   i'm seeing a seemingly unending series of errors like this:  at java.util.sublist.add(abstractlist.java:652)  written to stdout/stderr in the window where i run synctool.  i don't see anything obvious in any of the synctool log files to account for the error, and i can't read the status display from the synctool to tell if things are working despite the error, or if the train has gone off the tracks.  the errors persist across restarts.  i've tried it a couple of times now, including removing the contents of the log directory.  reverting back to version 2.0.0 cleared up the problem.",2,val
DURACLOUD-767,Use S3 bucket tags for system space properties and remove feature allowing users to set space properties.,"the new glacier storage provider brought back to light the missing ability in amazon s3 to set properties at the bucket level. up to this point, we have used a file in each bucket to store duracloud space properties, but this will not work in the glacier model, as that file will be archived to glacier along with all content.  as no current customers are making use of space properties, this issue can be resolved in two steps: 1. make use of s3 bucket tags to store the properties generated by durastore for each space created 2. remove the setspaceproperty feature  step 2 is necessary because of the limitations of s3 bucket tags. only 10 tags are allowed, none more than 256 characters. while it would be possible to allow for a very limited number of metadata/tags provided by the user using a limited character set, the fact that this feature is not currently in use suggests that it is simply not needed.",6,val
DURACLOUD-768,Bit Integrity Tools: Service report not created for empty spaces,"when running the bit integrity tools service over a space with 0 content items, it completes successfully with a link to a report file, but that report file does not actually exist.  note that this is the same problem which was reported and resolved in duracloud704. it appears to have been reintroduced.  this task is to ensure that bit integrity reports get generated and stored in xserviceout for empty spaces.",1,val
DURACLOUD-769,Remove Space Properties and Tags in Duradmin,"in order to support bill's strategy for glacier, see duracloud 767",1,val
DURACLOUD-771,UI: Expose the ability to retrieve content items from Glacier in DurAdmin,duracloud 754 adds the ability to use glacier as a storage provider. glacier requires additional steps to be able to retrieve content (as compared to other duracloud storage providers). this task is to expose those additional steps via the ui.,2,val
DURACLOUD-772,Glacier: provide a way for users to perform limited file retrievals,"the glacier storage provider allows for very low cost storage, but retrieval costs can add up very quickly. this task is to limit the ability of users to request content retrievals in such a way as to minimize the risk of high costs.",2,val
DURACLOUD-773,Allow Glacier to be used as a primary storage provider,"this task it to allow amazon glacier to be the primary provider in duracloud, rather than amazon s3.",3,val
DURACLOUD-774,Pull the UpSync tool into the DuraCloud baseline,"this task is to copy the upsync tool from the dfr codebase into the duracloud codebase in order to expose it as a duracloud feature and in order for ongoing development to occur.   once transferred, the tool should be tested with duracloud by both technical and non technical staff to ensure that it can be easily installed, it functions properly, and that there are no usability issues.",4,val
DURACLOUD-775,UI: Make client-side tools easily available,"this task is to update duradmin to provide very obvious links which allow users to download the client side tools (sync tool, upload tool, upsync, retreival tool).",2,val
DURACLOUD-776,Option for Retrieval Tool to set time stamps on retrieved files,duracloud 737 allows the sync tool to preserve local time stamp information in duracloud content item properties. this task is to add an option to the retrieval tool which will set the time stamps of files that have been retrieved (assuming that those files have time stamp information recorded in duracloud).,2,val
DURACLOUD-778,UI: Handle Glacier storage state errors gracefully,"when content is stored in glacier, attempts to download, view, copy, or edit the properties of that content will result in an error (http status 409). this task is to provide users with useful feedback when they attempt any of these actions on a content item in glacier.   more specifically, when a call is made on a glacier content item via the storeclient, a contentstateexception is thrown. (if the content item was recently added or has been retrieved from glacier, it will simply download as expected) this task is to show the user an appropriate error message indicating that the content is in glacier. for now, that error message can indicate that the user should contact duracloud support if they wish to retrieve that content item.",1,val
DURACLOUD-780,sync tool include top level directory option/flag,"after requests from several trial and customer users, the synchronization tool should provide a configuration option/flag in which the entire directory path is included upon upload. currently, the top level directory is ignored and not persisted in the naming of the content items that are uploaded via the sync tool. this new flag for the sync tool would enable the entire folder structure to be included in the name of the uploaded content.",1,val
DURACLOUD-781,SyncToolUI advance config,"this task is to add advanced config options to the sync tool ui. in particular, the user should be able to set the connection port as well as have the ability to select a ""sync deletes"" option.",2,val
DURACLOUD-784,Update Duracloud to the latest ActiveMQ,"duracloud has a dependency in the pom to activemq 5.2, an old version.  the version does not formally support java 7, supported in duracloud 2.3.  in particular, specialized settings are needed to work with java security.  duracloud 2.3 has been tested using activemq 5.7 and 5.8 so the update should require little effort and have little impact.",1,val
DURACLOUD-786,SyncToolUI: Allow for removing sync directories in initial config,"currently, when walking through the initial setup wizard of the synctool ui, if you select a sync directory or file accidentally, there is no way to remove it except to cancel and start the wizard over. this task is to allow selected directories or files to be removed, as they can be in the config update area.",2,val
DURACLOUD-787,Inconsistent Glacier Errors for Root Users in Duradmin,"root users attempting to edit, copy, or edit metadata on a file in glacier get inconsistent failure errors.",1,val
DURACLOUD-788,SyncToolUI: Notify user that restart is required after change to configuration.,"configuration tab: when changing the configuration, this does not take effect until there is a stop/start cycle of the tool. this should be indicated to the user, and an option should be provided to perform a stop/start now or to wait. ",2,val
DURACLOUD-790,UI on IE issues,"the following ui issues were discovered while using duradmin via ie during testing for the 2.3 release:  1. attempting to retrieve a glacier stored content item in ie does not show the expected notice message (that is seen in firefox and chrome), but instead displays the message ""this website is too busy to show the webpage."" 2. filtering on content item names does not work in ie 3. in ie, when a space refresh is performed, the selection of the space is forgotten, and the display responds as if the spaces tab were selected.",2,val
DURACLOUD-794,SyncToolUI: Allow clearing of errors,"this task is to provide a way, in the synctoolui, to clear any errors that have been noted on the errors list.",1,val
DURACLOUD-796,SyncToolUI should expose pause/resume functions of the synctool.,nan,2,val
DURACLOUD-798,"Synctool UI should stop promptly when the user clicks ""stop""","currently the tool remains in the ""stopping"" state until the currently active transfers are complete.",2,val
DURACLOUD-800,SyncToolUI: Better feedback for user without write permissions on space,"the synctoolui should be updated to provide better feedback to users when they have selected a space to sync to which they do not have permissions to write to. since there is not a simple way to collect this information up front, this task is to pay attention to exceptions that are coming back from a sync activity to determine if it is likely that they are a result of lacking permissions, then provide information to the user that will allow them to be aware of he problem and a suggested resolution.",1,val
DURACLOUD-801,Shibboleth: Add 403 Access Denied Page,this improvement is dependent on the shibboleth branch.  a duracloud branded 403 page should be rendered when an authenticated user who is not authorized to access duracloud tries to log in.,1,val
DURACLOUD-802,Shibboleth: Logout,"this improvement is dependent on the shibboleth branch. when a user logs out, he/she should be redirected to a page that specifies that complete logout requires closing the browser (ala the mc).",1,val
DURACLOUD-803,DuraCloud instance hitting 100% disk utilization,"initial issue:  after running synctool on a set of 200,000 files, the sync rate slowed from about 3,000 files transferred per 10 minutes to about 300 or less per 10 minutes.  reason for the slow down:  the reason the rate dropped, was because the instance storage space had become 100% consumed. the major culprit was the catalina.out and catalina.out.1 files in /mnt/log/tomcat6  reason there isn't much space available:  as it turns out, this ebs instance, as well as all other ebs instances, no longer include ephemeral storage space by default. it was expected that /mnt was mounted to a large ephemeral storage drive, but that is not the case.  further info: http:/docs.aws.amazon.com/awsec2/latest/userguide/instancestorage.html#usinginstancestorage ",1,val
DURACLOUD-804,Use JClouds library for all calls to OpenStack providers,the current openstack storage provider implementation uses both the client originally provided by rackspace (which has now been discontinued) as well as the jclouds library (which is now the client recommended by rackspace for java development: http:/docs.rackspace.com/sdks/guide/content/java.html).  this task is to update the openstack and rackspace storage providers to use only jclouds.,5,val
DURACLOUD-805,Can only perform a bulk action (e.g. deletion) on a maximum of 2 spaces at a time,"today i went in to cleanup some old demo/test content in 'dspacetest.duracloud.org'.  when i selected multiple spaces, i found that no matter how many spaces i selected, the total always read ""2 space(s) selected"".   even worse, i selected a total of 5 spaces and clicked ""delete selected spaces"" button.  only the first 2 spaces i selected were deleted.  the other 3 were kept.  it seems as though the multi select option only captures the first two spaces you select...after that, any other selections are ignored.  carissa has verified that this also seems to occur on demo.duracloud.org.",1,val
DURACLOUD-806,Recreate storage provider connections,"for some reason, on occasion, all calls to an sdsc provider will start to return 401 responses. when this happens, no calls go through to sdsc. this issue can currently be resolved immediately by reinitializing the instance. the issue also appears to resolve itself after some amount of time has passed.  since it appears that recreating the sdsc connection (which occurs on reinit) resolves the issue, this task is to update durastore to be able to recreate those connections. ideally this would happen when we start to see 401 failures, but another option would be to simply recreate the connections on a set schedule.",3,val
DURACLOUD-808,Space size alerts,it would be useful for users to be notified when their space reaches a configurable size.  this feature would allow the users to configure this information via duradmin.,3,val
DURACLOUD-809,"When starting sync in SyncTool UI throws an error,  the error message is ugly.",a more compact error description should be displayed   the large amount of text coming back in the message is breaking the look and feel.,1,val
DURACLOUD-810,Update GlacierStorageProvider to retrieve content item storage class,"this task is to update the calls for getting content properties in the glacierstorageprovider to include a call which will retrieve the storage class of each object, and include that information in the content item details. this will make it possible for users to know if a content item is stored in glacier, or if it has been retrieved back to s3.  information about the call that needs to be made to retrieve the storage class can be found here: https:/forums.aws.amazon.com/message.jspa?messageid=312132",1,val
DURACLOUD-811,Print URL to set up screen on the command line when the Sync Tool is executed in GUI mode,"especially on linux, the automatic display of the sync tool setup/admin screen is not reliably displayed in a browser.  also, when is does display if there are many browser windows open it is hard to find.  it would be helpful to display the url as a message when the sync tools is started from the command line.  it would also be helpful to display the url as part the tray icon in some fashion.",1,val
DURACLOUD-813,"UI: Remove upload tool applet, reinstate single file upload","now that there is a solid ui as part of the sync tool, and because of the seemingly constant issues with java applet technology, the multifile upload applet should be removed from duradmin and the single file upload option should be reinstated.  this work should occur alongside duracloud 775, which provides easy access to the sync tool.",3,val
DURACLOUD-823,Sync Tool: Provide feedback for Java issues,"there have been a variety of customer questions and issues reported in using the sync tool which mostly boil down to the user's system not having the necessary java version or not having java installed at all. this task is to provide actionable feedback to users as they attempt to use the sync tool, which will allow them to more easily resolve the problems and get the sync tool operational.",4,val
DURACLOUD-824,Sync Tool: Ability to restart on system reboot,"this task is to provide a way, on windows, mac, and linux systems for a sync tool that is running on shutdown to restart and continue running after a system restart.",3,test
DURACLOUD-825,S3StorageProvider: Remove dependency on a particular access key,"the s3storageprovider makes use of the aws access key as a prefix for bucket names, just to guarantee that the names are unique. the listing of buckets is also limited to only those with a matching access key.  now that aws does not make the secret key (essentially the password) available, if we were to lose the secret key, we would have to create another credential pair. if we were to do that, though, the s3storageprovider would show an empty space listing because the new access key will not match the bucket prefix. this also currently makes it impossible to use the aws iam service, which is a best practice.  this task is to allow the s3storageprovider to display and work with buckets regardless of the access key prefix. the prefix should still be used, since uniqueness is still necessary, and should still be stripped before displaying the space names for users. however, rather than requiring a specific access key, any key should work.  since this match will likely require a regex: according to aws docs, the access key id is a 20 character, alphanumeric sequence.",2,test
DURACLOUD-826,Retrieval Tool: Use logback for logging,"in duracloud 774 (in particular, the changes in code r1072) changed over the sync tool from using log4j to using logback as the underlying logger. this task is to update the retrieval tool in the same way.",1,test
DURACLOUD-827,add sync tool prepend source path (include top level directory) flag to synctoolui,nan,1,test
DURACLOUD-828,Retrieval Tool: Hidden password option,duracloud 759 added a hidden password for the sync tool. this task is to make use of the same environment variable to pick up the password for the retrieval tool. this will help to keep the functionality of the two tools in sync.,1,test
DURACLOUD-831,Support multiple instances of synctool ui on one machine,"currently the synctoolui assumes only one user per machine will be using the synctool.  if this assumption is incorrect, we may need to look into adding port negotiation into the installer mix to enable multiple installs of the synctoolui on a single machine.",2,test
DURACLOUD-832,RetrievalTool NullPointerException when using all spaces option (-a),"the retrievaltool throws a nullpointerexception when using the ""allspaces"" or ""a"" command line option and the ""spaces"" or ""s"" option is not specified, which the ""spaces"" option shouldn't need to be when using ""allspaces"".  the culprit is in retrievaltool#startretrievalmanager at the line: boolean createspacedir = retconfig.getspaces().size() > 1; because retrievaltoolconfig#getspaces returns null when the ""spaces"" command line option is not used.",1,test
DURACLOUD-833,synctoolui: unchecking options in configuration tab causes 404 error,the problem:  the controller dependends on the presence of property name in query param while uncheck form fields are not sent as empty values.  ,1,test
DURACLOUD-837,List MD5 option for space listing function of Retrieval Tool,it would be nice to be able to optionally list all the md5s as well as the raw list of contentids for a space.,1,test
DURACLOUD-838,"List contents of space from a ""pre-chunked"" point of view (Retrieval Tool)","it would be handy to be able to optionally list a space contents as it  will appear when retrieved.  that is, only list contentids as they will appear after they are restitched (do not show chunks or manifests).  it's a kind of dry run for the retrieval tool in a way.",1,test
DURACLOUD-839,Retrieval Tool:  Verify chunked manifests when generating prechunked listing,"it would be nice if we could tell the retrieval tool to verify that the manifest points to a complete set of chunks and that the chunk md5s match the manifest md5s.    this will be a handy addition to  https:/jira.duraspace.org/browse/duracloud837 and https:/jira.duraspace.org/browse/duracloud838  in verify mode, it would probably be a good idea to add a couple of columns to the output: verification status (success, failure) and an explanation column where there is a problem. ",1,test
DURACLOUD-841,Image gallery viewer,"in a cloud service strategy meeting on aug 6, 2013 (https:/wiki.duraspace.org/display/dspint/20130806cloudservicestrategy) there was a discussion about a need expressed by unc to have a way to view images in duracloud as a gallery, in order to aid in the finding of images in their collection.  i was thinking that this could be accomplished with an html/css/javascript app that is stored in one of the user's spaces, and allows them to select a space (if that's actually necessary, could be hard coded to the one that is their image library) and view a set of images. the javascript would need to make calls to the duracloud rest api to get the list of content items and display each one. the images would likely be scaled down a bit, to make browsing easier, and clicking on them would display the (slightly) larger size. the rest api would also be used to allow paging through the content items (and not trying to display too many at once). the option to specify a prefix for filtering would need to be there, and the user would need to be able to see the full content id of the item they are viewing, since that will be the link back to the full size archival image on their internal system.  there is an expectation that the unc folks will be generating the necessary lowres images that would be viewed through this gallery viewer, and would load those images into a duracloud space.",2,test
DURACLOUD-842,DurAdmin: Uploaded files should include same metadata as generated by Sync Tool,"when adding files, the sync tool captures metadata for the files. duradmin should capture the same metadata. the metadata items created by the sync tool includes:  creator  contentfilelastaccessed  contentfilepath  contentfilemodified  contentfilecreated",1,test
DURACLOUD-843,Make use of S3 Server Side Encryption,this task is to update the s3storageprovider to make use of the server side encryption feature provided by s3 (http:/aws.amazon.com/aboutaws/whatsnew/2011/10/04/amazons3announcesserversideencryptionsupport/)  implementation details: http:/docs.aws.amazon.com/amazons3/latest/dev/sseusingjavasdk.html  storing content with encryption should be the default.  another task will be needed to update existing content in s3 to make use of encryption. this will likely need to be done by performing a copy action on all existing content such that the copied item is encrypted as it is written to s3.,2,test
DURACLOUD-844,Sync Tool: Uninstalling with app running (on Windows) pops up error dialog,"if the sync tool is uninstalled while the application is running, the uninstall works properly, the application is stopped and all files are removed as expected, but an error dialog is popped up stating ""program ended with an error exit code"".   this popup does not show up if the application is not running when the uninstaller is run.  the dialog is popped up when the command: ""taskkill /f /t /im duracloudsync.exe"" is run by the uninstaller.  in testing for the 2.4 release i found that if the taskkill command is run without the ""/f"" force flag, the error dialog does not pop up and the exe process stops (the icon is removed from the task bar), but the java process continues to run, so the application is still available. if the command above, with the force flag is then run, the java app is stopped without a popup dialog. this is why a second call was added to the uninstaller, to try running without the force flag first. unfortunately, this did not work, the error dialog remains.",2,test
DURACLOUD-846,Update to the latest JClouds,in duracloud release 2.4 an issue with the jclouds library that was used (the latest at the time) was that it would not perform reauthentication when the auth token expired. this required a work around in durastore. the issue has now been fixed: https:/issues.apache.org/jira/browse/jclouds 178.  this task is to update to the latest jclouds library when possible.,1,test
