issuekey,title,description,storypoint,split_mark
MDL-39950,Reproduce log reports to use the new logging system (log and loglive),"convert reports /report/log/ and /report/loglive/ to the new api    reports must work nicely with both loglegacy and logstandard    # alter reports to accept new event object instances instead of array data.  # alter reports to understand new event properties.  # for each report add a setting which log reader to use  # deprecate function printlog(), move html to corresponding renderers  # deprecate functions printlogods(), printlogcsv(), printlogxls()   they should all be part of /report/log/  # deprecate function buildlogsarray()  # deprecate function getlogs_usercourse(), move code into /report/log/",40,train
MDL-39953,Replace Legacy events - Blogs,"replace all legacy events related to blogs.  blog/locallib.php:        eventstrigger('blogentryadded', $this);  blog/locallib.php:        eventstrigger('blogentryedited', $entry);  blog/locallib.php:        eventstrigger('blogentry_deleted', $this);",20,train
MDL-39954,Replace Legacy events - Assessable content,"replace all legacy events related to assessable content.  mod/assign/locallib.php:                eventstrigger('assessablesubmitted', $eventdata);  mod/assign/locallib.php:            eventstrigger('assessablesubmitted', $eventdata);  mod/assign/locallib.php:                eventstrigger('assessablesubmitted', $eventdata);  mod/assign/submission/file/locallib.php:        eventstrigger('assessablefileuploaded', $eventdata);  mod/assign/submission/onlinetext/locallib.php:        eventstrigger('assessablecontentuploaded', $eventdata);  mod/assignment/type/online/assignment.class.php:        eventstrigger('assessablecontentuploaded', $eventdata);  mod/assignment/type/upload/assignment.class.php:            eventstrigger('assessablefileuploaded', $eventdata);  mod/assignment/type/upload/assignment.class.php:        eventstrigger('assessablefilesdone', $eventdata);  mod/assignment/type/uploadsingle/assignment.class.php:                    eventstrigger('assessablefileuploaded', $eventdata);  mod/forum/lib.php:    eventstrigger('assessablecontentuploaded', $eventdata);  mod/workshop/submission.php:        eventstrigger('assessablecontentuploaded', $eventdata);",40,train
MDL-39955,Replace Legacy events - Completion,"replace all legacy events related to completion.  lib/completionlib.php:        eventstrigger('activitycompletionchanged', $data);  completion/completioncompletion.php:            eventstrigger('coursecompleted', $this >getrecorddata());",20,train
MDL-39956,Replace Legacy events - Cohort,"replace all legacy events related to cohort.  cohort/lib.php:    eventstrigger('cohortadded', $cohort);  cohort/lib.php:    eventstrigger('cohortupdated', $cohort);  cohort/lib.php:    eventstrigger('cohortdeleted', $cohort);  cohort/lib.php:    eventstrigger('cohortmemberadded', (object)array('cohortid'=>$cohortid, 'userid'=>$userid));  cohort/lib.php:    eventstrigger('cohortmemberremoved', (object)array('cohortid'=>$cohortid, 'userid'=>$userid));",8,train
MDL-39957,Replace Legacy events - Course,"replace all legacy events related to course.  course/lib.php:    eventstrigger('coursecreated', $course);  course/lib.php:    eventstrigger('courseupdated', $course);  lib/moodlelib.php:    eventstrigger('coursedeleted', $course);  lib/moodlelib.php:    eventstrigger('coursecontentremoved', $course);  lib/coursecatlib.php:        eventstrigger('coursecategorydeleted', $this);  lib/coursecatlib.php:        eventstrigger('coursecategorydeleted', $this);  backup/util/plan/restoreplan.class.php:        eventstrigger('courserestored', (object) array(",20,train
MDL-39958,Replace Legacy events - Groups,"replace all legacy events related to groups.  group/lib.php:    eventstrigger('groupsmemberadded', $eventdata);  group/lib.php:    eventstrigger('groupsmemberremoved', $eventdata);  group/lib.php:    eventstrigger('groupsgroupcreated', $group);  group/lib.php:    eventstrigger('groupsgroupingcreated', $data);  group/lib.php:    eventstrigger('groupsgroupupdated', $group);  group/lib.php:    eventstrigger('groupsgroupingupdated', $data);  group/lib.php:    eventstrigger('groupsgroupdeleted', $group);  group/lib.php:    eventstrigger('groupsgroupingdeleted', $grouping);    plurals:    group/lib.php:    eventstrigger('groupsmembersremoved', $eventdata);  group/lib.php:    eventstrigger('groupsgroupingsgroupsremoved', $courseid);  group/lib.php:    eventstrigger('groupsgroupsdeleted', $courseid);  group/lib.php:    eventstrigger('groupsgroupings_deleted', $courseid);",20,train
MDL-39959,Replace Legacy events - module,"replace all legacy events related to module.  course/dnduploadlib.php:        eventstrigger('modcreated', $eventdata);  course/lib.php:    eventstrigger('moddeleted', $eventdata);    all places where course modules are created, updated(?) or deleted.",20,train
MDL-39960,Replace Legacy events - role,"replace all legacy events related to role.  lib/accesslib.php:    eventstrigger('roleassigned', $ra);  lib/accesslib.php:        eventstrigger('roleunassigned', $ra);  lib/accesslib.php:                    eventstrigger('roleunassigned', $ra);  ",8,train
MDL-39961,Replace Legacy events - User,"replace all legacy events related to user.  admin/tool/uploaduser/index.php:                eventstrigger('userupdated', $existinguser);  admin/tool/uploaduser/index.php:            eventstrigger('usercreated', $user);  admin/user.php:                eventstrigger('userupdated', $user);  admin/user.php:                eventstrigger('userupdated', $user);  auth/email/auth.php:        eventstrigger('usercreated', $user);  auth/ldap/auth.php:        eventstrigger('usercreated', $user);  lib/enrollib.php:            eventstrigger('userenrolled', $ue);  lib/enrollib.php:            eventstrigger('userenrolmodified', $ue);  lib/enrollib.php:        eventstrigger('userenrolmodified', $ue);  lib/enrollib.php:            eventstrigger('userunenrolled', $ue);  lib/enrollib.php:            eventstrigger('userunenrolled', $ue);  lib/eventslib.php:function eventstrigger($eventname, $eventdata) {  lib/moodlelib.php:    eventstrigger('userlogout', $params);  lib/moodlelib.php:    eventstrigger('usercreated', $db>getrecord('user', array('id'=>$user>id)));  lib/moodlelib.php:            eventstrigger('userupdated', $db>getrecord('user', array('id'=>$oldinfo>id)));  lib/moodlelib.php:    eventstrigger('userdeleted', $user);  enrol/manual/locallib.php:                    eventstrigger('userenrolmodified', $enrolment);  user/edit.php:    eventstrigger('userupdated', $usernew);  user/editadvanced.php:        eventstrigger('usercreated', $usernew);  user/editadvanced.php:        eventstrigger('userupdated', $usernew);  user/emailupdate.php:        eventstrigger('userupdated', $user);  user/lib.php:    eventstrigger('usercreated', $newuser);  user/lib.php:    eventstrigger('userupdated', $updateduser);    please also check user/lib.php userupdateusers() from mdl 34422 (if it has been integrated)  eventstrigger('userupdated', $user); ",40,train
MDL-39962,Replace Legacy events - Mixed,"replace all legacy events related to lti,workshop.  workshopviewed   ltiunknownserviceapicall     replace event handlers with event observers.  mod/workshop/allocation/scheduled/db/events.php    workshopallocationscheduledworkshopviewed      edit   quiz events moved to a separate issue. portfolio_send also moved to a separate issue.    ",20,train
MDL-39963,Legacy events and addtolog()  Cleanup,"# make sure there is no remaining addtolog() calls in core, or agree on whether they should be deprecated but kept for a while or not.  # make sure there is no legacy events left in core. see mdl45055  # make sure all new events use the correct naming convention. see mdl43557  # create a mapping list, listing all old events/addtolog() and respective new event. add this list to docs. see mdl44637  # cleanup lib/db/events.php, either delete all events listing or add all new events to the list. see mdl45052  # once mdl40997 is resolved, make sure all existing events have the legacyassertions when needed.  # implement can_view() for all events. see mdl44107  ",40,train
MDL-40003,Assignment submission comments are not restored,"if ""submission comments"" is set to yes in an assignment and comments are made against a submission then when the course or activity is then backed up and restored with ""comments"" and user data, the comments are not restored.",5,train
MDL-40020,Check usage of comment::init() and set component param,"with mdl 37243 fix, component name should be passed by plugins using comments.  currently init check values from optional_param, it will be nice to set them with proper validation.",20,train
MDL-40034,Epic: File API improvements to handle clustering environments,"this has been talked about for many years but appears not to have an issue filed for it.    moodle files currently go into dataroot directory on the server filesystem.    this can cause problems when moodle is used in server cluster environments where there may not even be local filesystems, when synchronisation is required across potentially many web servers.    this issue is the starting point for solving this problem.    1) collect solutions/ideas/hacks from the community and discuss.  2) define a specification for core implementation in moodle  3) split into subtasks under this issue.  4) complete the implementation.",40,train
MDL-40037,POLICY: Decide if we should allow context to be exposed by WS or not,"decide the final stand on if we should allow or not context ids in any ws api  decision: use of contextid, can be provided optionally. every ws api, must implement an alternative way , that doesn't require contextids.",13,train
MDL-40039,Add alternative to contextid for core_files_external::upload,"add alternative to contextid for corefilesexternal::upload, contextid shouldn't be a required field as per the discussion on mdl 40037 ",5,train
MDL-40040,Replace add_to_log with an event trigger - Blog,"replace the addtolog calls for the following area, with a call to the getlegacylogdata function in the event class.    blog/ (6 calls)  /blog/index.php:227: addtolog($courseid, 'blog', 'view', 'index.php?entryid='.$entryid.'&amp;tagid='.@$tagid.'&amp;tag='.$tag, 'view blog entry');  /blog/locallib.php:262: addtolog(siteid, 'blog', 'add', 'index.php?userid='.$this>userid.'&entryid='.$this>id, $this>subject);  /blog/locallib.php:299: addtolog(siteid, 'blog', 'update', 'index.php?userid='.$user>id.'&entryid='.$entry>id, $entry>subject);  /blog/locallib.php:317: addtolog(siteid, 'blog', 'delete', 'index.php?userid='. $this>userid, 'deleted blog entry with entry id# '. $this>id);  /blog/locallib.php:356: addtolog($courseid, 'blog', $action, 'index.php?userid='.$this>userid.'&entryid='.$this>id, $this>subject);  /blog/locallib.php:360: addtolog($cm>course, 'blog', $action, 'index.php?userid='.$this>userid.'&entryid='.$this>id, $this>subject, $cm>id, $this >userid);",20,train
MDL-40041,Replace add_to_log with an event trigger - Course,"replace the addtolog calls in the following directory, with new events which contains the same information:    course/ (21 calls)  ",40,train
MDL-40042,Replace add_to_log with an event trigger - completion,"replace the addtolog calls in the following directories, with new events which contains the same information:    completion  /course/completion.php:138: addtolog($course>id, 'course', 'completion updated', 'completion.php?id='.$course>id);  /report/completion/user.php:53: addtolog($course>id, 'course', 'report completion', ""report/completion/user.php?id=$user>id&course=$course>id"", $course>id);",20,train
MDL-40043,Replace add_to_log with an event trigger - course,"replace the addtolog calls in the following directories, with new events which contains the same information:    course  /course/recent.php:41: addtolog($course>id, ""course"", ""recent"", ""recent.php?id=$course>id"", $course>id);  /course/delete.php:68: addtolog(siteid, ""course"", ""delete"", ""view.php?id=$course>id"", ""$course>fullname (id $course>id)"");  /course/manage.php:252: addtolog($course>id, ""course"", ($visible ? 'show' : 'hide'), ""edit.php?id=$course>id"", $course>id);  /course/manage.php:280: addtolog($movecourse>id, ""course"", ""move"", ""edit.php?id=$movecourse>id"", $movecourse>id);  /course/lib.php:2041: addtolog($course>id, ""course"", ""move"", ""edit.php?id=$course>id"", $course>id);  /course/lib.php:2291: addtolog(siteid, 'course', 'new', 'view.php?id='.$course>id, $data>fullname.' (id '.$course>id.')');  /course/lib.php:2380: addtolog($course>id, ""course"", ""update"", ""edit.php?id=$course>id"", $course>id);  /course/user.php:108: addtolog($course>id, ""course"", ""user report"", ""user.php?id=$course>id&amp;user=$user>id&amp;mode=$mode"", ""$user>id"");  /course/editsection.php:72: addtolog($course>id, ""course"", ""editsection"", ""editsection.php?id=$id"", ""$sectionnum"");  /course/view.php:117: addtolog($course>id, 'course', $loglabel, ""view.php?"". $logparam, $infoid);  /course/loginas.php:70: addtolog($course>id, ""course"", ""loginas"", ""../user/view.php?id=$course>id&amp;user=$userid"", ""$oldfullname > $newfullname"");    /index.php:79: addtolog(siteid, 'course', 'view', 'view.php?id='.siteid, siteid);  ",20,train
MDL-40044,Replace add_to_log with an event trigger - role,"replace the addtolog calls for the following area, with a call to the getlegacylogdata function in the event class.    role  /admin/roles/manage.php:93: addtolog(siteid, 'role', 'delete', 'admin/roles/manage.php', $roles[$roleid]>localname, '', $user>id);  /admin/roles/override.php:128: addtolog($course>id, 'role', 'override', 'admin/roles/override.php?contextid='.$context>id.'&roleid='.$roleid, $rolename, '', $user>id);  /admin/roles/assign.php:114: addtolog($course>id, 'role', 'assign', 'admin/roles/assign.php?contextid='.$context>id.'&roleid='.$roleid, $rolename, '', $user>id);  /admin/roles/assign.php:134: addtolog($course>id, 'role', 'unassign', 'admin/roles/assign.php?contextid='.$context>id.'&roleid='.$roleid, $rolename, '', $user>id);  /admin/roles/define.php:199: addtolog(siteid, 'role', $action, 'admin/roles/define.php?action=view&roleid=' .  /admin/roles/allow.php:49: addtolog(siteid, 'role', 'edit allow ' . $mode, strreplace($cfg>wwwroot . '/', '', $baseurl), '', '', $user >id);  /lib/accesslib.php:1524: addto_log(siteid, 'role', 'delete', 'admin/roles/action=delete&roleid='.$roleid, $rolename, '');  ",13,train
MDL-40045,Replace add_to_log with an event trigger - User,"replace the addtolog calls for the following area, with a call to the getlegacylogdata function in the event class.    /user/index.php:89: addtolog($course>id, 'user', 'view all', 'index.php?id='.$course>id, '');  /user/view.php:191: addtolog($course>id, ""user"", ""view"", ""view.php?id=$user>id&course=$course>id"", ""$user>id"");  /auth/ldap/auth.php:1739: addtolog(siteid, 'user', 'login', ""view.php?id=$user>id&course="".siteid,  /auth/shibboleth/index.php:65: addtolog(siteid, 'user', 'login', ""view.php?id=$user>id&course="".siteid, $user>id, 0, $user>id);  /login/changepassword.php:123: addto_log($course>id, 'user', 'change password', ""view.php?id=$user>id&course=$course>id"", ""$user>id"");",20,train
MDL-40046,Replace add_to_log with an event trigger - mod_page,"replace the addtolog calls for the following area, with a call to the getlegacylogdata function in the event class.    mod/page  /mod/page/index.php:36:addtolog($course>id, 'page', 'view all', ""index.php?id=$course>id"", '');  /mod/page/view.php:54:addtolog($course>id, 'page', 'view', 'view.php?id='.$cm>id, $page>id, $cm>id);  ",20,train
MDL-40047,Replace add_to_log with an event trigger - mod_feedback,"replace the addtolog calls for the following area, with a call to the getlegacylogdata function in the event class.    mod/feedback (6 calls)  /mod/feedback/completeguest.php:213: addtolog($course>id,'feedback', 'startcomplete', 'view.php?id='.$cm>id, $feedback>id);  /mod/feedback/index.php:43: addtolog($course>id, 'feedback', 'view all', $url>out(false), $course>id);  /mod/feedback/deletecompleted.php:79: addtolog($course>id, 'feedback', 'delete', 'view.php?id='.$cm>id, $feedback>id, $cm>id);  /mod/feedback/complete.php:269: addtolog($course>id, 'feedback', 'submit', 'view.php?id='.$cm>id, $feedback>id, $cm>id, $userid);  /mod/feedback/complete.php:213: addtolog($course>id, 'feedback', 'startcomplete', 'view.php?id='.$cm>id, $feedback>id, $cm>id, $userid);  /mod/feedback/view.php:100: addtolog($course>id, 'feedback', 'view', 'view.php?id='.$cm>id, $feedback>id, $cm>id);",20,train
MDL-40048,Replace add_to_log with an event trigger - mod_chat,"replace the addtolog calls for the following area, with a call to the getlegacylogdata function in the event class.    mod/chat (6 calls)  /mod/chat/chatajax.php:94: addtolog($course>id, 'chat', 'talk', ""view.php?id=$cm>id"", $chat>id, $cm>id);  /mod/chat/report.php:50: addtolog($course>id, 'chat', 'report', ""report.php?id=$cm>id"", $chat>id, $cm>id);  /mod/chat/index.php:17: addtolog($course>id, 'chat', 'view all', ""index.php?id=$course>id"", '');  /mod/chat/guiheaderjs/insert.php:61: addtolog($course>id, 'chat', 'talk', ""view.php?id=$cm>id"", $chat>id, $cm>id);  /mod/chat/guibasic/index.php:108: addtolog($course>id, 'chat', 'talk', ""view.php?id=$cm>id"", $chat>id, $cm>id);  /mod/chat/view.php:73: addtolog($course>id, 'chat', 'view', ""view.php?id=$cm>id"", $chat>id, $cm>id);",20,train
MDL-40049,Replace add_to_log with an event trigger - mod_choice,"replace the addtolog calls for the following area, with a call to the getlegacylogdata function in the event class.    mod/choice (5 calls)  /mod/choice/report.php:46: addtolog($course>id, ""choice"", ""report"", ""report.php?id=$cm>id"", ""$choice>id"",$cm>id);  /mod/choice/index.php:17: addtolog($course>id, ""choice"", ""view all"", ""index.php?id=$course>id"", """");  /mod/choice/lib.php:296: addtolog($course>id, ""choice"", ""choose again"", ""view.php?id=$cm>id"", $choice>id, $cm>id);  /mod/choice/lib.php:310: addtolog($course>id, ""choice"", ""choose"", ""view.php?id=$cm>id"", $choice>id, $cm>id);  /mod/choice/view.php:79: addtolog($course>id, ""choice"", ""view"", ""view.php?id=$cm>id"", $choice>id, $cm>id);",20,train
MDL-40050,Replace add_to_log with an event trigger - webservices,"replace the addtolog calls for the following area, with a call to the getlegacylogdata function in the event class.    webservices  /webservice/lib.php:74: addtolog(siteid, 'webservice', getstring('tokenauthlog', 'webservice'), '', getstring('invalidtimedtoken', 'webservice'), 0);  /webservice/lib.php:81: addtolog(siteid, 'webservice', getstring('tokenauthlog', 'webservice'), '', getstring('failedtolog', 'webservice') . "": "" . getremoteaddr(), 0);  /webservice/lib.php:145: addtolog(siteid, 'webservice', 'user unconfirmed', '', $user>username);  /webservice/lib.php:151: addtolog(siteid, 'webservice', 'user suspended', '', $user>username);  /webservice/lib.php:157: addtolog(siteid, 'webservice', 'nologin auth attempt with web service', '', $user>username);  /webservice/lib.php:166: addtolog(siteid, 'webservice', 'expired password', '', $user>username);  /webservice/lib.php:850: addtolog(siteid, 'webservice', getstring('simpleauthlog', 'webservice'), '' , getstring('failedtolog', 'webservice')."": "".$this>username.""/"".$this>password.""  "".getremoteaddr() , 0);  /webservice/lib.php:870: addtolog(siteid, '', '', '', getstring('wsaccessuserdeleted', 'webservice', $user>username) . ""  "".getremoteaddr(), 0, $user>id);  /webservice/lib.php:876: addtolog(siteid, '', '', '', getstring('wsaccessuserunconfirmed', 'webservice', $user>username) . ""  "".getremoteaddr(), 0, $user>id);  /webservice/lib.php:882: addtolog(siteid, '', '', '', getstring('wsaccessusersuspended', 'webservice', $user>username) . ""  "".getremoteaddr(), 0, $user>id);  /webservice/lib.php:895: addtolog(siteid, '', '', '', getstring('wsaccessuserexpired', 'webservice', $user>username) . ""  "".getremoteaddr(), 0, $user>id);  /webservice/lib.php:902: addtolog(siteid, '', '', '', getstring('wsaccessusernologin', 'webservice', $user>username) . ""  "".getremoteaddr(), 0, $user>id);  /webservice/lib.php:929: addtolog(siteid, 'webservice', getstring('tokenauthlog', 'webservice'), '' , getstring('failedtolog', 'webservice')."": "".$this>token. ""  "".getremoteaddr() , 0);  /webservice/lib.php:947: addtolog(siteid, 'webservice', getstring('tokenauthlog', 'webservice'), '' , getstring('failedtolog', 'webservice')."": "".getremoteaddr() , 0);  /webservice/lib.php:1061: addtolog(siteid, 'webservice', '', '' , $this>zendclass."" "".getremoteaddr() , 0, $this>userid);  /webservice/lib.php:1522: addtolog(siteid, 'webservice', $this>functionname, '' , getremoteaddr() , 0, $this>userid);    /admin/webservice/service.php:61: addtolog(siteid, 'webservice', 'delete', $returnurl, getstring('deleteservice', 'webservice', $service));  /admin/webservice/service.php:78: addtolog(siteid, 'webservice', 'add', $returnurl, getstring('addservice', 'webservice', $servicedata));  /admin/webservice/service.php:88: addtolog(siteid, 'webservice', 'edit', $returnurl, getstring('editservice', 'webservice', $servicedata));  /admin/webservice/serviceusers.php:60: addtolog(siteid, 'core', 'assign', $cfg>admin . '/webservice/serviceusers.php?id='  /admin/webservice/serviceusers.php:74: addtolog(siteid, 'core', 'assign', $cfg>admin . '/webservice/serviceusers.php?id='    webservice (login)  /login/token.php:164: addtolog(siteid, 'webservice', 'automatically create user token', '' , 'user id: ' . $user>id);  /login/token.php:174: addto_log(siteid, 'webservice', 'sending requested user token', '' , 'user id: ' . $user>id);",40,train
MDL-40051,Replace add_to_log with an event trigger - misc,"replace the addtolog calls for the following area, with a call to the getlegacylogdata function in the event class.    lib  /lib/uploadlib.php:772: addtolog($courseid, 'upload', 'upload', ((!$nourl) ? substr($server['httpreferer'], 0, 100) : ''), $newfilepath);  /lib/uploadlib.php:786: addtolog(0, 'upload', 'infected', $server['httpreferer'], $oldfilepath, 0, $userid);  /lib/moodlelib.php:5791: addtolog(siteid, 'library', 'mailer', qualifiedme(), 'error: '. $mail >errorinfo);    mnet  /mnet/lib.php:446: addtolog(siteid, 'admin/mnet', 'update', 'admin/mnet/accesscontrol.php',  /mnet/lib.php:455: addtolog(siteid, 'admin/mnet', 'add', 'admin/mnet/accesscontrol.php',    report  /report/questioninstances/index.php:38: addtolog(siteid, ""admin"", ""report questioninstances"", ""report/questioninstances/index.php?qtype=$requestedqtype"", $requestedqtype);    admin/tool  /admin/tool/capability/index.php:95: addto_log(siteid, ""admin"", ""tool capability"", ""tool/capability/index.php"", count($capabilities));",20,train
MDL-40052,Replace add_to_log with an event trigger - course reports,"replace the addtolog calls for the following area, with a call to the getlegacylogdata function in the event class.    course / reports  /report/participation/index.php:66: addtolog($course>id, ""course"", ""report participation"", ""report/participation/index.php?id=$course>id"", $course>id);  /report/log/index.php:118: addtolog($course>id, ""course"", ""report log"", ""report/log/index.php?id=$course>id"", $course>id);  /report/log/graph.php:70: addtolog($course>id, 'course', 'report log', ""report/log/graph.php?user=$user>id&id=$course>id&type=$type&date=$date"", $course>id);  /report/log/user.php:65: addtolog($course>id, 'course', 'report log', ""report/log/user.php?id=$user>id&course=$course>id&mode=$mode"", $course>id);  /report/loglive/index.php:51: addtolog($course>id, 'course', 'report live', ""report/loglive/index.php?id=$course>id"", $course>id);  /report/stats/index.php:70: addtolog($course>id, ""course"", ""report stats"", ""report/stats/index.php?course=$course>id"", $course>id);  /report/stats/graph.php:65: addtolog($course>id, 'course', 'report stats', ""report/stats/graph.php?userid=$userid&id=$course>id&mode=$mode&roleid=$roleid"", $course>id);  /report/stats/user.php:52: addtolog($course>id, 'course', 'report stats', ""report/stats/user.php?id=$user>id&course=$course>id"", $course>id);  /report/outline/index.php:40: addtolog($course>id, 'course', 'report outline', ""report/outline/index.php?id=$course>id"", $course>id);  /report/outline/user.php:56: addtolog($course>id, 'course', 'report outline', ""report/outline/user.php?id=$user>id&course=$course>id&mode=$mode"", $course>id);",20,train
MDL-40053,Replace add_to_log with an event trigger - notes,"replace the addtolog calls for the following area, with a call to the getlegacylogdata function in the event class.    notes   /notes/index.php:64: addtolog($courseid, 'notes', 'view', 'index.php?course='.$courseid.'&amp;user='.$userid, 'view notes');   /notes/lib.php:107: addtolog($note>courseid, 'notes', 'add', $logurl, 'add note');   /notes/lib.php:114: addtolog($note>courseid, 'notes', 'update', $logurl , 'update note');   /notes/lib.php:134: addtolog($note >courseid, 'notes', 'delete', $logurl, 'delete note');",13,train
