issuekey,title,description,storypoint,split_mark
MDL-1626,Forum: Per-discussion subscription,"i am finding that my inbox is absolutely flooded with unwanted moodle mails off the forum script. this is very annoying and i know it will similarly annoy my users. in fact it will put them off the system.    the problem arises because unlike other discussion boards moodle messages are emailed to me from the entire forum, not just the thread i have started or responded to. the overwhelming of people's inboxes is a serious business: it could be said that moodle is generating spam because the email feature is so unfocused.    is there any chance this is going to be improved please?",100,train
MDL-3714,Forum: Reply by e-mail,how about the ability to post to the forums via email?,100,train
MDL-5583,allow teachers to specify certain fields in database activity as required,"when creating a database, allow the teacher to specify whether a field must be filled in or not.",20,train
MDL-8501,Forum: proceed to next thread link,"please put a link to jump to the next thread in the forum interface... forums are very cool but the evaluation process is time consuming and, for a teacher, time is everything when evaluating 100s of students...  ",20,train
MDL-10115,A use profile's course list is arbitarily limited with no way of seeing complete list,"when viewing a user's profile, if the list of their courses exceeds 21 (i think) an ellipsis is displayed. this seems a bit useless because... a) you can't click on the ellipsis to see the rest of the courses b) the list isn't even in alphabetic order so it becomes even more arbitrary c) the ellipsis is easy to miss, so you may not realise the list is truncated  suggest either making this work properly, i.e., the ellipsis is clickable or if the list is not considered important just put ""too many courses to show"" if it exceeds a certain amount. it would seem sensible to display them in alphabetic order too.  without this it is difficult for an administrator to see all the courses a user is in if (for example) checking role assignments.",13,train
MDL-12403,backup or import of single quiz includes all questions in database,"when making a backup of individual quizzes, no matter how many (or how few) quizzes i back up, the backup includes all questions from the question bank, not only those used in the quiz which i'm backing up. so, in an extreme case, if i back up a single quiz, and then restore it to another course, i unintentionally transfer hundreds of questions along with this quiz.    the same happens when importing a quiz to another course.",100,train
MDL-13114,Include bulk course create and remove with Moodle through the use of CSV files,"we're looking to moodle for a replacement to blackboard enterprise.  in order for moodle to be a viable replacement we need a way to bulk create and delete courses based on csv files.  the bulk create courses is handled by use of a 3rd party module (uploadcourse.php created by rory allford).  however once we import say 700+ courses there's no way to them bulk remove them at the end of a semester (removing 1 by 1 would be too time consuming).  we would really prefer that this functionality be included within moodle, as relying on 3rd party modules (no matter how good they are), inherits a risk if the module stops getting updated.",100,train
MDL-16073,"Add ""test database setup"" to the ""External Database"" enrollment and authentication plugins","it is hard to test whether the administrative panel for external database authentication and for external database enrollment is configured correctly. currently, you have to create fake user accounts or similar, and try to authenticate them or enroll them and see if they receive email, etc. (at least, that's how i tested it! does someone have a better way?)    it woule be nice to have a ""test connection"" button on that page which goes through and makes sure all the db info (username, password, connection, etc.) and data mapping is correct. and prints out all this stuff to the screen in an easytoread report.    thank you!",4,train
MDL-16474,Allow single-item scales,"the single item scale, ""useful"", used on moodle.org is in demand! see http:/moodle.org/mod/forum/discuss.php?d=105515    currently only scales of 2 or more items may be created.",8,train
MDL-16982,Adding data mapping for custom user fields,i'd like having the possibility to add data mapping for custom user fields when i use ldap or db auth modules,40,train
MDL-17081,"Implement import/export ""Permissions"" settings for ""Manage roles"" tab","suggest to implement ""import / export"" settings for the role ""permissions"". see the two proposed solutions (probably only one need to be implemented)... this is particularly useful for larger ""enterprise level"" moodle implementation as we often have staging, testing, and development moodle installations and if we have customized role settings, it is a pain in the butt to manually change all of them one by one (it's a long list of the ""permissions"" for all the newly deployed moodle instances. thanks!",20,train
MDL-18014,Automatically and periodically save WYSIWYG editor content as a draft/concept,this emerged during the discussion at mdl13370. shortly: use ajax to automatically and periodically (eg. every minute) save the content of a wysiwyg editor to the concepts (drafts) space. see gmail for the working example.    it seems to me that we could use table mdl_post for this therefore not db changes should be required. there will be a flag for a rich text field definitions that enables this feature. every wysiwyg will have to have some uniq identifier. concepts are accessible to their owners only (and admins?)  maybe via a card in their profiles? their lifetime is a subject of configuration   couple of hours by default.,40,train
MDL-18229,Add grade item and student grades quick edit feature to the grader report,add grade item and student grades quick edit feature to the grader report to enable editing for each grade item and for each student:     grades and feedback   grade overrides    excluded grades    thanks to developers at the lsu for this feature   see http:/moodle.org/mod/forum/discuss.php?d=101449 for more details.  ,100,train
MDL-18375,Displaying and selecting dates throughout Moodle should allow the use of multiple calendars,i implemented a patch to add the capability of working with other calendar systems than just gregorian.  i'll provide the instructions to apply the patch in following post,100,train
MDL-18633,User profile: add last ip field to user view,"similar to mdl18518, this request to add the last ip address could be useful to a site administrator trying to track down where a user last access moodle from. patch for 1.9 attach, i'll come up for one for head as well. peace  anthony",2,train
MDL-18770,Non-graded Assignment and Quizzes appear in the gradebook  and have Max Grade assigned,"nongraded assignment and quizzes are getting displayed in the gradebook, and they look like being included into aggregation in the cat&items interface, since they have max grade value set to 100.  other activities behave definitely. e.g. if forum is not graded, it does not appear in the gradebook as a column. which for me is an expected behavior.    1. add an assignment. set it to no grade. column will still appear in the gradebook. now go to the cat&items interface. it will display max grade for that column to be 100 points. (though it will not be actually included into the calculation)  2. add an assignment. set it to be graded on a scale (scales are not included in aggregation for us). maximum grade in the cat&items interface will display some number (e.g. 3, if there are 3 items in a scale). it is confusing, since one would now expect that 3 to be calculated toward course/category total.  3. add a quiz, add some questions, and make the quiz to be worth 0 points. maximum grade in the cat&items interface will still be 10 points (or 100). interestingly enough, i can manually delete a gradebook column for this kind of quiz. (but, once i delete a column, there is no way for me add it back, even though i will make the quiz gradable)    i think mdl14017 is related to this. ",13,train
MDL-20045,Add unofficial support for custom context levels,"this issue is in reference to http:/moodle.org/mod/forum/discuss.php?d=111362. in brief, one of our moodle extensions would benefit greatly from being able to use moodle's roles and contexts system, and we would need to define our own context levels.  however, we would like to be able to do this without having to differ from core in unmaintainable ways. we believe that this would be helpful to many other moodle partners and plugin developers, and some of our proposed changes may help to improve the maintainability and readability of core moodle code.",40,train
MDL-20250,"Add admin settings for disabling particular gradebook calculations, category overriding and grade minimum on the grader report","an admin setting for selecting which aggregation types are available was added to moodle 1.9.5.    further admin settings for disabling gradebook features such as multiplicator, offset, calculations (see mdl 18049 for details of exactly which features) should be added to moodle 2.0.",40,train
MDL-21180,Category children default to extra credit when category agg is switched from Weighted to Simple,"category 1 is set to weighted mean of grades  its children all have weights assigned to them  category 1's agg method is switched to simple weighted mean of grades  its chlldren are now all extra credit    this was kinda, supposedly fixed with mdl 19407 but only took into account an item moved from a category of wm to swm... not if the entire category is switched (common in our parts).",40,train
MDL-21415,Course Participation Report doesn't abide by separate groups,"in  1.97 (haven't tested other versions), the participation report shows all students to a nonediting teacher in a group.   my courses are set to separate groups, and permissions for nonediting teacher for showallgroups are set to prevent. when i log in as a non editing teacher i set up, and go to the course reports, click the participation report, choose an activity, and then set ""show only"" to student, all student show up.   shouldn't the participation report also respect separate groups?",20,train
MDL-21469,Chat window uses browser language rather than preferred language set in profile,steps to reproduce:  1. set browser language to say dutch. 2. login to demo.moodle.net with any of the demo accounts. 3. access http:/demo.moodle.net/mod/chat/view.php?id=203 and click the enter the chat.  expected result: text in the chat window is in english (preferred language set in profile)  actual result: text in chat window is in dutch,3,train
MDL-22236,Design way to send files by web service (upload),"find a way to send any files to any draft file area in moodle and use them in the web service calls.      original issue description:    sending files to hub currently works but the design has been refused by petr because it uses ws token in a post request with $_files. after talking with dongsheng and petr, the conclusion was we will be sending files by web service (probably called in a cron script, if the file is too big). and biggest files will be chunked in order to be sent. it implies to write a new file web service design.  downloading files could need to follow the same design...    ",40,train
MDL-22669,Moodle bug with course restore section count,"course import/restore: if source course has more sections, create them and increase numsections          before this, all modules that were in non existant sections sent to section 0. ",8,train
MDL-23646,"TinyMCE can't be resized and doesn't scroll for wide content, especially on small screens","when editing an html page in 2.0 on a netbook (i think the one i saw was an eeepc) the screen is so small that the dragging handle of tinymce gets cut off and the whole thing is pretty well useless   see http:/screencast.com/t/nme1odewm for an example. no idea if this is something which is fixable by setting the default width of the editor based on the width of the browser, but thought i'd mention it anyway...    replication steps:  # log in as admin  # navigate to site admin > appearance > site selector  # choose a theme with blocks on the right, such as binarus  # navigate to a course  # create a page resource  # reduce the size of the browser window and note the effect on the html editor    expected result: the html editor resizes down before it is covered by blocks on the right.    actual result: the right edge of the html editor disappears under the blocks.",20,train
MDL-24120,Allow admin to remain logged in after login as procedure,"log in as admin to moodle 2 go to a course (home page is enough) from participants block, select a student and login as him/her do something (at least nothing) and return to your personal account at the end of this process, you are always logged out",20,train
MDL-24287,Convert group members selector to Shifted YUI3 module.,"after working on mdl 24262 i think it is a very good idea to convert the group/user selectors to object orientated yui modules with all arguments being passed in rather than set as globals within the page. this will make the code clearer, and help improve js sandboxing.  cheers sam",13,train
MDL-24343,Properly deprecate unzip_file/zip_file,"sam  related to your recent commit for mdl19786, i did a grep of 2.0 code base and found a couple more instances of where the deprecated unzipfile/zipfile is being used:    /question/format/blackboard_six/format.php  /lib/componentlib.php    peace  anthony     p.s.  perhaps we should create a meta issue to grep for deprecated functions as part of code clean up",3,train
MDL-24380,Chat: autoscroll help popup incorrect and doesn't display fully (it only concerns the alternative chat methods),"autoscroll help popup gives info on using chat, rather than the autoscroll feature.",3,train
MDL-24775,a pagedown key press in any tinymce editor destroys entire page layout,a page down in any tinymce editor will kill the layout of (maybe almost) any page in moodle.  ,20,train
MDL-25473,Embedded MP4 videos via linking to the course file loops when finished playing.,when i embed a quicktime video (mp4) like this:     /     it loops automatically when it is finished playing. this doesn't   happen with flv videos.     i went into the moodle folder   >filter   >multimediaplugin    >find every occurrence of the word loop (there were 4) and   change true to false.   then i went back to where the video was embedded and added this tag   before my embedded link:     /     the video stopped after playing once. ,5,train
MDL-25544,Improve Grader report user interface,"this issue is a large one focussed on improving usability and accessibility for teachers using moodle gradebook (grader report) on all browsers including touch screens and screen readers.    the moodle gradebook working group met in june 2014 and determined a number of key required features, which are detailed on the specification at http:/docs.moodle.org/dev/graderreport2014  (still being finished).    in a nutshell expect:  # full screen spreadsheet like display that scrolls well but has static headers and footers.  # filters to quickly reduce the information being dealt with.  # links to row/column editors for speed and affordances.",100,train
MDL-26170,Deleted Forum & Blog Posts in RSS Block,"in moodle 2.0.1+, even after deleting forum/blog post, it continues to show up in the rss block even after cron is run. spammers can exploit this.",8,train
MDL-26244,'Choose a link' for database URL field gives confusing message,"going to add/edit a record in the ""modules and plugins"" database a user founds a lot of ""choose link"" button. the problem is that these buttons are completely useless because the file picker page they call, displays: ""spiacente, nessuno dei repostory disponibili può restituire file esterni."" [that in english should sound like: sorry, none of the available repository may return external files.]  please take these buttons off.",8,train
MDL-26408,IMS Enterprise admin notifications fail on message_send(),"error:  coding error detected, it must be fixed by a programmer: could not load preference messageproviderimsenterpriseimsenterpriseenrolmentloggedoff. does the component and name you supplied to messagesend() match a row in messageproviders? message providers must appear in the database so users can configure how they will be notified when they receive messages.  !! blah !! !! stack trace:  line 126 of /lib/messagelib.php: codingexception thrown  line 247 of /enrol/imsenterprise/lib.php: call to messagesend()  line 364 of /lib/cronlib.php: call to enrolimsenterpriseplugin &gt;cron()  line 79 of /admin/cron.php: call to cronrun()  !!  does look like any db/messages.php  ",2,train
MDL-27158,Default timezone is incorrect when not set in PHP configuration,"when 'date.timezone' is not set in the php server configuration, moodle sets the base timezone to php's default which is 'asia/jayapura'. when you then set a timezone in the administration area, to say 'australia/adelaide', the time is half an hour too fast. if the 'date.timezone' is set in the php server configuration, this is not an issue.    the problem seems to be that php is still thinking 'asia/jayapura' is the base timezone, which is gmt9 hours. when moodle stores the timestamp, it subtracts the 9 hours from the current time, storing a ""utc"" timestamp value. when moodle then goes to display a time (i.e. assignment conditional access times), it adds 9.5 hours to the timestamp which gives the incorrect time.    when using ""server's local time"", it works fine and there is no issue either. however, if moodle is set to use ""server's local time"", and then a user manually sets their timezone, it is again incorrect.    might be related to mdl 22625, but it seems a little different again.",20,train
MDL-27339,"The link Create ""File system"" instance do not work","if an admin has defined that user can add repository instances into the user context, user sees the create file system instance link, but they don't get permission to do this.   screen shows on left left side admin settings and the parts in the middle and on the right side are the users view.",5,train
MDL-27953,"Upload users option only allow the following authentication options: Manual account, or No login","when uploading a csv file of users in 2.0.3 the ""choose an authentication"" dropdown only gives the following options:    manual account  no login    in 1.9.x i get the following authentication options:    manual account  no login  ldap server  emailbased self registration    ",8,train
MDL-28162,[ERROR] Automated backup status,"using automated backup i continue to receive errors  summary ==================================================  courses: 15  ok: 7  skipped: 3  error: 0  unfinished: 5   some of your courses weren't saved!!  as you can see some courses save ok and others are skipped and 3 are unfinished.  the errors look like this   course         time taken                         status next backup ashs vle 3 jul, 06:01      3 jul, 06:01 ok 4 jul, 06:00 gcse ict unit 1 3 jul, 07:41   4 may, 22:53 unfinished 5 may, 18:00 student council 3 jul, 09:16      4 may, 22:52 unfinished 5 may, 18:00 staff room 5 may, 18:21           5 may, 18:21 skipped 6 may, 06:00 resources 3 jul, 02:51   4 may, 22:52 error 5 may, 18:00 gcse ict chap 1 5 may, 18:26   5 may, 18:26 skipped 6 may, 06:00 gcse ict unit 2 3 jul, 04:26   4 may, 22:52 error 5 may, 18:00 functional skil 3 jul, 06:01   3 jul, 06:01 ok 4 jul, 06:00 yr11 ict group 1 jan, 00:00   1 jan, 00:00 skipped 1 jan, 00:00 year 7         3 jul, 06:01   3 jul, 06:01 ok 4 jul, 06:00 year 8 ict 3 jul, 06:01   3 jul, 06:02 ok 4 jul, 06:00 year 9 ict 3 jul, 06:02   3 jul, 06:02 ok 4 jul, 06:00 gcse french 3 jul, 06:02   1 jan, 00:00 error 1 jan, 00:00 gcse german 3 jul, 07:36   3 jul, 07:36 ok 4 jul, 06:00 gcse maths 3 jul, 07:36    3 jul, 07:36 ok 4 jul, 06:00  if i try to look at the detailed backup logs for any course i get the message  detailed execution log course: ashs vle no logs have been found ",100,train
MDL-28448,Teachers cannot delete user submissions - advanced uploading of files,in 1.9 teachers had the ability to delete submitted files as well as revert the status to draft.    in 2.x the teacher deletion of files is not possible.,20,train
MDL-28631,forbid use of cookies especially from javascript,"our developers and theme designers keep smuggling in cookies, this is not compatible with $cfg>cookiehttponly and is against some privacy laws.  simply stop relying on cookies and if necessary use user preferences.  offenders:  admin roles ui  lib/cookies.js  scorm data model  repository   anomaly theme   solution: 1/ educate integrators and developers  see mdl 17084 for ajax user preferences 2/ fix the code 3/ fix dev docs",40,train
MDL-29070,Clean enrol_imsenterprise following coding guidelines,"while reviewing mdl28962 i detected that enrol/imsenterprise/lib.php is one of the worst files i've seen from the pov of moodle coding guidelines (spaces, comments..., if/loop...).    i think it would be great to perform a general cleanup for it. for your consideration if only dev or all 2.x stable branches too (note that, right now the file is 100% the same in 20, 21 and master). i'm sending this to stable backlog initially.    ciao :)",3,train
MDL-29441,Chat window does not pop up for separate groups in IE7-9,"using separate groups and ie7, 8 or 9, when you click to enter the chat it does nothing. if you select all groups you can enter the chat.    replication steps:  # setup 2 groups  # go to a chat where the group mode is ""separate groups""  # in the upper left corner, select a group  # try to enter the chat",4,train
MDL-30195,Export forum discussion without attachments to google docs portfolio,"we've got google docs portfolio enabled in our moodle site.  now, when i want to export a forum discussion to google docs and no forum post within this discussion contains any attachments, the export works flawlessly.  as soon as a forum post within this discussion contains an attachment (mainly an image) and a) when exporting the whole discussion, there is a nice but meaningless error message saying ""no common formats between any available portfolio plugin and the calling location forumportfoliocaller"" b) when exporting a single post, google docs is not available anymore as portfolio   would it be possible to improve this to export the forum discussion to google docs regardless of any attachment so that the user gets at least the discussion text?",20,train
MDL-30431,Attempting to edit wiki comments from another user causes an error,"replication steps:  # user a (student role) creates a comment on a wiki  # user b (teacher role) tries to edit user a's comment  # when user b tries to save the edited comment        coding error detected, it must be fixed by a programmer: invalid state passed to moodlepage::setstate. we are in state 0 and state 3 was requested. http:/docs.moodle.org/21/en/error/debug/codingerror       user a is able to edit their own comment quite happily",13,train
MDL-30668,Prevent the grader report from storing serialized data in the user_preferences table,see mdl 20245. when categories are collapsed on the grader report it appears than an array is serialized and stored in the user_preferences table. this table is really for simple name value pairs.  it would be good if we could avoid storing serialized data and instead only stored human readable data.,20,train
MDL-30812,Latest backup files generate error/setting_invalid_ui_label upon restore,"administrators and staff are unable to restore recently created course backup files. prior to the upgrade to 2.1.3 any backup file created can be restored into a new course even now. since this upgrade the restore process goes through the steps, but upon pressing ""restore"" an error/settinginvaliduilabel is generated and upon pressing continue the restored course is showing up as an invisible course in the process of being restored, but never completes. we did an upgrade to the latest moodle version 2.2 but this did not alleviate the error. the problem appears to be with the creation of the backup file as any created since the upgrade to 2.1.3 is now generating the error/settinginvaliduilabel and all backups created prior to 2.1.3 can still be restored successfully.",20,train
MDL-30839,form validation and error recovery,"a better mechanism needs to be used to help users identify errors in form submissions. the text that appears on the page after an invalid submission is not easily found by screen reader users. there are several techniques for improving error recovery in forms. the basic premise is to 1. either automatically set the focus to the error message (usually used serverside validation) or use aria attributes to notify the user of an error message (usually used clientside validation) 2. provide enough detail in the error message so the user knows what the error was 3. provide links within the context of the error message to allow users to easily jump to the parts of the form where errors occurred  webaim's tutorial on error recovery in forms http:/webaim.org/techniques/formvalidation/#error  w3c technique for ""creating a mechanism that allows users to jump to errors"" http:/ techs/g139.html ",20,train
