issuekey,title,description,storypoint,split_mark
MDL-44762,Atto title plugin bugs. It is possible to choose a title from the menu and nothing happens,"notes from demo:    menu isn't closed when selecting a title (or applied) (select, choose h2, select text, open menu, press escape, open menu press h2   stays same)    this happens on firefox, not chrome",13,val
MDL-44763,"Atto image plugin - remove the word ""Preview"" from the dialogue.",it's unnecessary.,2,val
MDL-44764,Change wording in Atto image plugin,"this is about the alt / decorative only fields.    new wording: “describe this image for someone who cannot see it�? / “description not necessary""  ",5,val
MDL-44765,atto_image: Dialogue is not resized after the accessibility warning is displayed,"using the image plugin:   open the plugin   find an image    try to submit without setting alt or presentation    issue:  the dialogue is not resized. this is fine for most users, but for users on small height devices, the submit button may have dropped off the bottom of the page.",5,val
MDL-44768,Atto: Save cursor position with undo/redo stack and restore it,this was a suggestion from fred in the atto demo.,40,val
MDL-44769,"Atto Table plugin caption field should be a text input, not a textarea",simples.,3,val
MDL-44770,"Change table context menu, to open from the table button, not the table cell","also maybe change the wording to e.g. ""insert column after current cell"".    ",8,val
MDL-44771,Atto tables with long captions wrap into the table,this is a css bug in the table plugin styles.css  it sets a fixed height on the caption which should be a minheight.,5,val
MDL-44772,Atto does not respect height of original text area field any more (it used to),"something changed here, and now atto is always huge. yuk!    (seriously this is a real problem on long forms).",13,val
MDL-44773,Accessibility checker does not trigger selection updated when it selects the image nodes,and so the image button in the toolbar is not highlighted. the accessibility helper does this correctly.,5,val
MDL-44775,Atto : show html view with a monospace font,what it says,2,val
MDL-44776,Make Atto equation editor dialogue wider ,just a bit (keep mobile in mind too please),5,val
MDL-44777,Atto Equation Editor example toolbar should have consistently sized buttons,"set a min width on the buttons in the examples toolbar, so they will line up better.",3,val
MDL-44778,"Atto equation editor, put a border around the preview",what it says,2,val
MDL-44779,MathJax menus show behind dialogues,this is most noticable in the atto equation editor,13,val
MDL-44780,Enable MathJax filter by default,for new installs. not sure about upgrades (you don't want 2 tex filters and you don't really know which other filters handle tex).,5,val
MDL-44781,Reformat/rewrite the help text for MathJax (needs some line breaks) ,reported by andrew n,2,val
MDL-44782,Fix lang string for Mathjax filter setting HTTP (Should be HTTPS),what is says,2,val
MDL-44784,Atto plugins with settings do not show settings links on manage plugins page.,probably something to do with plugininfo.,20,val
MDL-44794,"get_groups(), get_groups_all() and groups_get_user_groups are not covered by unit tests",the following functions are used all over moodle but are not currently covered by unit tests. behat tests should cover them to a large degree but it would be nice to have additional assurance.    1) getgroupsall() and getgroups($groupingid = 0) in modinfolib.php do not appear to be covered at all in modinfolibtest.php.    2) groupsgetusergroups() in grouplib.php. groupsgetusergroups() is itself not tested at all in grouplib_test.php,8,val
MDL-44806,Accessibility checker goes wide unnecessarily ,it would be better if it adapted to the content better.,5,val
MDL-44808,"The table creation box is huge, giving too much room to the accessibility info","the problem with this dialogue being so big, is it makes me want to see at the bottom for something important.    it seems to me like this info is getting too much prominence. ",2,val
MDL-44810,The bold/italics buttons don't maintain their selection when pressed,"steps to reproduce:    # in atto, write ""damo rulez""  # select the word ""damo"" word and press bold button    expected result:  the word ""damo"" is formatted bold and the selection remains on ""damo""     actual result:  the word ""damo"" is formatted bold but the selection is not retained and the insertion point moves to the end of the word.    note: this is contrasting behaviour to google docs for eg. (and i guess ms word etc)",5,val
MDL-44824,Strings missing for some subplugins,"logstore subplugins are displayed on plugins overview page as:  ""log store manager / logstore""    there is a string missing to translate internal name ""logstore""    same with assignsubmission, assignfeedback, ltisource  (i think we can ignore ""assignment 2.2"" subplugin)",2,val
MDL-44826,Atto Too many image alignment options,i think superscript and subscript can be removed   probably some others too. we want to keep these interfaces simple.,5,val
MDL-44827,Atto: Insert image fails on iOS 7,buy me and iphone and i'll fix it :),13,val
MDL-44830,Atto: Redo behaviour is a bit wonky,undo/redo can get a little confused so that there are duplicates on one of the stacks. a bit of testing multiple undo/redos shows this in action.   ,8,val
MDL-44831,Atto: Save to undo stack on text deletion,"the undo stack save is triggered by arrow keys and clicks on the content area. this is based on testing the native undo in chrome. we could possibly improve this to save the position when someone starts deleting things (but if they hit delete 15 times we should only save for the first one).     we could do this by detecting that the new text is shorter than the previous text, save the stack and set a ""deleting"" flag.     we would need to test the performance of this with a really long bit of text in a sucky browser (guess which). ",8,val
MDL-44832,mod_assign grading table menus do not show,"some new yui bug   the menus are positioned way off the screen.    probably easiest to move these to ""edit"" menus like the course editing ones.    the old ones could not be tested by behat anyway.",5,val
MDL-44844,Custom menu broken in all non-bootstrap themes. ,"the custom menu code uses the ""yui3 menunav"" module (which is deprecated). for some reason this is broken in master (probably because of a yui update). bootstrapbase provides it's own renderer for this which uses the yui module for bootstrap so it's not affected.    i noticed this was broken in mod_assign and fixed it by converting to an actionmenu  this doesn't really help with custom menu though.    ",13,val
MDL-44846,Atto font colors are broken in IE,"this needs to be investigated, but in ie9:     regardless of the text i have in the field, the form validation was reporting it as empty.   switching to html view does not work    and maybe other issues.    note: i might have played with fontcolor and backcolor during the test, mayve that is related.",8,val
MDL-44874,Per-request temp directories,"according to http:/docs.moodle.org/dev/serverclusteringimprovementsproposal#.24cfg.3etempdir: ""if any script tries to use temp files that were not created during current request it is a bug that needs to be fixed.""    now in load balanced environment (without sticky sessions) with multiple web servers and local temp  dirs defined on the web servers local file systems, there are at least two cases where files are used for more than the current request:   upload users via csv   restoring course backups    trying to perform the above actions leads to errors and the inability to complete the actions unless the local tempidr ""$cfg>tempdir"" is removed from the configuration, losing the local tempdir functionality.    this issue introduces a new function:      makerequestdirectory($exceptiononerror = true);      this can be used in the same way as maketemp_directory(), but it does not take a subdirectory as an argument.  it always outputs the full path to the new directory, and ensures that it will be deleted after the request finishes.",40,val
MDL-44881,The dialogue to pick a file in file picker is not nicely styled,"see screenshots for the following:     the checkboxes are not well displayed   the padding on the right of the text inputs is too small, they seem to close to the edge   the info at the bottom do not have separator   when there is a separator at the bottom, it is glued to both sides   from an accessibility point of view, i'm pretty sure the file info are not properly ready as span is not considered as a word separator   margins below and above the fields seems unnecessarily high    all themes are affected, so clean and base should be tested. to select base pass ?theme=base to the url.",20,val
MDL-44923,"The gradebook export xml format does not handle the settings ""Export new or updated grades only""","the setting ""export new or updated grades only"" in the gradebook export xml format is only handled in the preview, not in the file.    to reproduce:  # go to the gradebook in a course with some graded activity  # be sure to have an id for each activity and for the course category in the gradebook  # in the export section, select the xml format  # be sure to select ""export new or updated grades only""  # click submit  # the preview will only show the new or updated grades as expected  # click download    expected result: the exported file should only contain new or updated grades.    actual result: the file will include all grades, not only the new or updated grades, which is wrong.",20,val
MDL-44927,Atto: UX improvements for table editing.,"it was discussed in scrum and we are not yet happy with the table editing controls in atto.    we will probably move to a more comprehensive table editing dialogue in the future  but it is too late to start work on that for 2.7  in the meantime there are 2 improvements that can be made to the context menu that will make it much nicer to use.    1. add an option to add/remove the caption for a table  2. hide options that don't make sense when the menu opens (e.g. add caption to a table with a caption, move the left column to the left)    when i implemented this issue and tested it it still was confusing to use so i went further.    i made the entries in the context menu hidden when they didn't make sense for the selected cell   and added a ""edit table"" entry that opens a window to edit the caption and change the headers for the table.",13,val
MDL-44929,Update to YUI 3.17.2,"due for release on tuesday 8th april, during our code freeze week.    current history rollup is at https:/gist.github.com/andrewnicols/9948045 but there are still a few items missing which will be integrated this week.    we are currently affected by:   drag/drop broken for some devices in 3.15.0 whilst trying to fix android (https:/github.com/yui/yui3/pull/1721)   calendar css in rtl (and nonrtl as it happens) (https:/github.com/yui/yui3/issues/1685); and    logging levels (minor and not yet in the history).    because yahoo! are based in california, i suspect that we won't actually see this until tuesday evening but i think that we should consider whether we allow this in anyway.    from our pov, it's only a patch release  i think it's a minor release from yui's pov because they're including a new pure module in with the css which dictates a minor release rather than a patch.    the drag/drop issue is the main consideration imo.",8,val
MDL-44949,Repository picking in Atto Image plugin broken,there is a bug in mdl 44000 that prevents picking an image from a repository.,2,val
MDL-45029,Weight Defaults to Zero in Weighted Mean of Grades Aggregation Method,"when adding new assignments to new courses, weight of grade in gradebook defaults to zero with the ""weighted mean of grades"" aggregation method in certain situations.  if new assignment is added, and gradebook has been set to ""simple weighted mean"" then switched to desired ""weighted mean of grades"" aggregation, default weight will show up as 1.0 as is intended.  however, once grading aggregation has been switched to ""weighted mean of grades"", subsequent assignments added will have a default weight of 0 in the gradebook instead of intended 1.0.    steps to reproduce:    1. add new course and save.  2. go to new course main page, click ""turn on editing""  3. go to first available week, click ""add an activity or resource""  4. click assignment and add  5. name assignment, add description, click ""save and return to course""  6. click course administration<grades<categories and items  7. click full view option  8. notice aggregation is set at default to ""simple weighted mean of grades""  9. select drop down menu for aggregation, change to ""weighted mean of grades""  11. save changes  12. notice weight default shows up as 1.0 as intended.  13. return to your course, and add new assignment with same steps detailed above within same week or in new week.  14. save and return to course  15. click course administration<grades<categories and items  16. click full view  17. notice aggregation is set to ""weighted mean of grades"" as this setting was earlier changed and saved.  18. notice default weight of most recently added assignment is now showing as 0, when it should be 1.0        ",20,val
MDL-45040,Atto: Selection reverts to previous selection on toolbar button press in WebKit browsers,"this presents when a selection is made by dragging such that the cursor is outside of the editor when the mouse button is released.    repro steps:  # launch atto.  # select some text, making sure that the cursor stays within the editor (a good way to do this is by double clicking on a word).  # select some other text, dragging outside of the editor and releasing your mouse button.  # click a toolbar button.  #  observe that your selection reverted to the first thing you selected.  ",5,val
MDL-45070,add support for MariaDB 10.x from Ubuntu,"ubuntu is using a bit more complex database version  ""5.5.510.0.10mariadb1~saucylog""  we need to relax the regex a bit.",2,val
MDL-45292,Bad RTL filepicker styles,"a few css styles in the filepicker only look good on ltr, or at the very least don't consider rtl circumstances.    2.5.x:  theme/base/filemanager.css   line 72, .fptoolbar div paddingright rule   applies erroneously under rtl   line 72, .dirrtl .fptoolbar div width:100px rule   this rule came in with mdl32479 and seems like a really, really bad idea (see https:/tracker.moodle.org/secure/attachment/37967/private%20files%20rtl.png )   line 74, .fptoolbar img marginright rule   applies erroneously under rtl   line 79, .fpviewbar style definition includes an 8px marginright under ltr (recent files ltr.png)   not a problem under rtl since in that circumstance the element in question floats left; this rule should be removed   need a textalign rule (and an rtl rule to match) because the viewbar is actually narrower than 72px; it takes up 72px, but due to negative margins actually appears smaller.   line 81, .dirrtl .fpviewbar definition includes an explicit width declaration @ 100px (private files rtl.png)   72px is enough and we need horizontal space for alfresco's selectbox (see mdl36836)    2.6.x: ( https:/tracker.moodle.org/secure/attachment/37975/26%20private%20files.png )  theme/base/filemanager.css   line 73, .filepicker .fptoolbar div, .fpnavbar .filemanagertoolbar .fptoolbar div margin rule   no matching rtl definition   line 89, .dirrtl .filepicker .fpviewbar marginleft:0 rule    erroneous   puts the viewbar right up against the border",5,val
MDL-45381,Mod_forum subscriptioncreated and subscriptiondeleted events link to incorrect locations,# create a forum  # enable optional subscription  # edit subscribers  # add a subscriber  # remove a subscriber  # check the logs    change the mod_forum 'subscriptioncreated'  and 'subscriptiondeleted' events to link to mod/forum/subscribers.php.    identified in: https:/tracker.moodle.org/browse/mdl44928?focusedcommentid=285859&page=com.atlassian.jira.plugin.system.issuetabpanels:commenttabpanel#comment 285859,5,val
MDL-45395,PHP-OLE is GPL-incompatible,"we removed it in mdl42381..    but as reported by debian, we have another instance in lib/phpexcel/phpexcel/shared/ole     https:/bugs.debian.org/cgibin/bugreport.cgi?bug=746594    note that in http:/docs.moodle.org/dev/moodlelibrariescredits#pearoleclasses    it's specified that an 'exception' was made for moodle. that implies relicensing and is all bit hazy. if we don't need it we should get rid of it..",40,val
MDL-45504,Decide Moodle 2.8 requirements and push them to environment.xml,"we need to decide asap about all the php/db/moodle versions requirements and put all them into the environmental tests (adding them to all supported branches).    at the same time, if there is any change in the php version... some changes have to be populated to various installers and replace them by the new one when corresponding. to get a list of candidates:    grep r '5\.x\.y'   | grep '\.php'    (and look for mdl39007 status, about to unify all those duplicated checks)  (and don't forget about the myisam thing @ mdl46064)    ciao :)",13,val
MDL-45562,Editing external blog throws exception,"register an external blog.  click on ""edit cog"", change something and try to save.    reproduced on 2.7, pretty sure the same will be in previous versions      invalid user    more information about this error  debug info: select id from  where id is null and deleted = ?  [array (  0 => 0,  )]  error code: invaliduser  stack trace:        line 1451 of /lib/dml/moodledatabase.php: dmlmissingrecordexception thrown      line 1427 of /lib/dml/moodledatabase.php: call to moodledatabase>getrecordselect()      line 6404 of /lib/accesslib.php: call to moodledatabase>getrecord()      line 107 of /blog/externalblogedit.php: call to contextuser::instance()    output buffer: / /notice/: undefined property: stdclass::$filtertags in /home/marina/repositories/intmaster/moodle/blog/externalblogedit.php/ on line /102/ / /notice/: undefined variable: newexternal in /home/marina/repositories/intmaster/moodle/blog/externalblogedit.php/ on line /107/ / /notice/: trying to get property of non object in /home/marina/repositories/intmaster/moodle/blog/externalblogedit.php/ on line /107/   ",8,val
MDL-45580,PDF Annotations Remain After PDF is Replaced,"when a student edits an assignment submission and deletes a pdf that was already annotated by the teacher and then adds a new pdf submission, the annotations given by the teacher for the old pdf remain in the new pdf.    steps to reproduce:  # in any course, create an assignment that allows file submissions.  # as a student, submit a pdf file for the assignment.  # as a teacher, annotate the student's pdf submission and save.  # as the student, return to the assignment and click edit submission.  # delete the existing pdf file and upload a new pdf file.  save changes.  # as the teacher, access assignment and click view/grade all submissions.  # click grade icon under grade column for the same student.  # launch pdf editor and observe    expected results: annotations from the old pdf file should not display in the new pdf submission.    actual results: annotations from the old pdf file are retained and display in the newly submitted pdf file.  ",20,val
MDL-45594,Fix use of ORDER BY id in the messaging system,"to peer reviewer    there are two diffs to review here, please comment on which you think is the better solution; or if you think neither of them are.    mark's: https:/github.com/markn86/moodle/compare/master...mdl45594master  tim's: https:/github.com/markn86/moodle/compare/master...mdl45594master_alt        see mdl35453.    problem lines of code:      message    lib.php (3 matches)      715: select mr1.useridto as userid, max(mr1.id) as mid      721: select mr2.useridfrom as userid, max(mr2.id) as mid      732:  order by mr.id desc"";       741: select m1.useridto as userid, max(m1.id) as mid      747: select m2.useridfrom as userid, max(m2.id) as mid      758:  order by m.id desc"";       799:  order by mr.id desc"";/ordering by id should give the same result as ordering by timecreated but will be faster   ",20,val
MDL-45611,Question text overlaps other parts of the UI on the edit quiz page.,"on the edit quiz page, the question text for random questions overlaps the maximum mark input box and other things. see the screen grab.    to reproduce:  # add a new quiz to a course.  # add several questions to a category in the question bank.  # on the edit quiz page, add a random question selecting from that category to the quiz.  # observe overlap as in the screen grab.",13,val
MDL-45652,"When restoring a backup, if no category or course is selected the page reloads with no error message","if you restore a backup and at the destination stage, you choose to create a new course but do not select a category, the page reloads upon pressing the continue button.  there needs to be an error message stating why the page reloads, as currently it's not obvious that you've forgotten to select which course.    steps to replicate:  # log in as admin/course creator  # click 'restore' in site administration  # upload a backup  # at destination stage, click the continue button under ""restore as a new course"" without selecting a category.    expected result: the page would reload and generate an error telling you  that you must select a category to restore to    actual result: the page reloads with no indication as to why it reloaded.",8,val
MDL-45721,"The \core\event\course_restored event is triggered on any restore, not just courses.",# visit a course.  # duplicate an activity.  # notice there is a 'course restored' event.,5,val
MDL-45754,Backup and restore of logs in 2.7 and above,new logging api does not support backup and restore of logs,100,val
MDL-45772,"Some forms with passwords and usernames get populated by the browser, which is not desired","when i tried to create a new group in a course, my username and password were prepopulated in the group id and the password for the group.  step 1: create group in a course  step 2: look at the prepopulated fields (group id and password) they are the same as my ldap username and password.    i had a colleague log in on my machine with his credentials and my details were prepopulated.    when my colleague logged in on his machine his details were prepopulated    my thoughts are if they are pre populating here then were else are they populating.    i have cleared cache. logged out then back in again    regards  brendan",20,val
MDL-45780,"Neither formchangechecker, nor quiz autosave detects changes in Atto editors","both quiz autosave code mod/quiz/yui/src/autosave/js/autosave.js, and lib/yui/src/formchangechecker/js/formchangechecker.js require special code to work with tinymce.    it seems that it they will alos need special code to work with atto, but noone has written that.    to reproduce (quiz)  # (optional) add $cfg>forcedpluginsettings = array('quiz' => array('autosaveperiod' => 3)); to your config.php to make thes easier to test. (just a 3 second delay between a change and an autosave.)  # ensure you have a default setup using atto, not tinymce or another editor.  # create a quiz containing one essay question, that uses the 'html editor with file picker' response type.  # attempt the quiz, and open the console. (the autosave code outputs useful debug messages to tell you what is going on   assuming you have developer debug on.)  # type something in atto, and verify that 3 seconds later (or whatever delay you set) an autosave ajax request happens.  # add an image to atto using the filepicker, and verify that cause an autosave too.    to reproduce (formchangechecker)  # go to a form, and click to make a new post.  # type an x in the message box.  # click the back button. you should get a warning that you are about to leave a page with unsaved data, but you don't.",13,val
MDL-45827,Specify the requirements for the element library,"this should be a dev docs page describing the element library tool, and describing how a developer would add a renderable/renderer method to the tool.     it should list the mandatory and optional features for this tool requires in order to meet the goals specified in: http:/docs.moodle.org/dev/renderlibraryspecification#elementlibraryandstyleguide",5,val
MDL-45828,Create the element library admin tool,implement the admin tool defined in mdl 45827,8,val
MDL-45829,Define the initial list of renderables to be added to the element library,"the proposed categories for renderables are:    elements  components (built of smaller elements)  layouts (structured arrangements of smaller components/elements/layouts)    the names of these categories needs to be agreed on, and docs created to describe each category.     an (early) list of renderables is defined here: http:/docs.moodle.org/dev/renderlibraryspecification#initialthoughtsonrenderablesandwhatweshouldprovide_.28draft.29    this list needs reviewing and categorising. ",20,val
MDL-45830,Define style guide for renderables,"this document should go hand in hand with the element library, but will define best practices to follow when creating the default implementations of renderables.     see: http:/docs.moodle.org/dev/renderlibraryspecification#style_guide",40,val
