issuekey,title,description,storypoint,split_mark
MDL-42047,"Removing ""Custom instance name"" from Cohort enrollment when Cohorts no longer exist causes Coding error","when editing cohort sync enrollment in a course if the user removes the ""custom instance name"" for the instance and the cohorts that the instance points to no longer exist, this causes the following error on that course's enrollment methods screen:    notice: trying to get property of nonobject in /opt/rlcache/www/master/enrol/cohort/lib.php on line 49    notice: trying to get property of nonobject in /opt/rlcache/www/master/enrol/cohort/lib.php on line 49    coding error detected, it must be fixed by a programmer: invalid context id specified context::instancebyid()    more information about this error  debug info:  error code: codingerror  stack trace:        line 5221 of /lib/accesslib.php: codingexception thrown      line 49 of /enrol/cohort/lib.php: call to context::instancebyid()      line 165 of /enrol/instances.php: call to enrolcohortplugin>getinstance_name()    this stops the user from being able to view/edit enrollment methods for a course and you have to readd a name via database in order to get back to the enrollment methods screen for that course.    to replicate:    create a cohort with members at system level  add a cohort sync enrollment method to a course and give it a custom instance name and choose the cohort you just created.  now go back to site admin > users > cohorts and delete the cohort you created.  go to the course where you added the cohort sync and edit the enrollment method and remove the custom instance name and save.    i know this seems like a unique situation but i actually had this happen and had to really search for the answer as the error code does not really lead you to the ""name"" of the instance, as at first glance it leads you to believe it is a context issue.    ",1,train
MDL-42054,phpmailer unit test redirection is using incorrect test,"see https:/tracker.moodle.org/browse/mdl41196?focusedcommentid=246970&page=com.atlassian.jira.plugin.system.issuetabpanels:commenttabpanel#comment246970    yuliya bozhko added a comment  29/sep/13 10:50 pm  looking through the comments history, i think in moodlephpmailer.php it should check not redirected messages, but redirected emails...     if (phpunittest && phpunitutil::isredirecting_phpmailer()) {    otherwise, if i redirect emails only, my message sink is always empty. discovered while trying to write tests for mdl 41956.  ",2,train
MDL-42078,Uninstalling multiple plugins usability and bugfixes,"suddenly some of my dev sites have started to show a lot of ""missing from disk"" plugins, mainly innocent ones (no db...). that was integrated last week if i'm not wrong.    what i'm finding annoying is that, if i click the ""uninstall"" button to get rid of any of them.... after confirmation and deletion... i'm redirected to admin/index.php, where the missing plugins are also show but without uninstall option. so i've to go again to admin/plugins.php and continue with the next one.    just guessing if it would be possible any of this:     add the uninstall option to admin/index.php, or   after uninstall, get redirected to the page that ignited the uninstall (admin/plugins.php).    ciao : )",40,train
MDL-42079,Repeating events in external calendar do not appear in Moodle Calendar,"to reproduce:  # setup a publicly shared google calendar  # add a single daily repeating event  # copy the ical link from the calendar's settings ""calendar address""  # goto the calendar and ""import calendar..."" form  # select ""calendar url"" and paste the url into  # sets as ""user events""  # you get an ""events imported"" message saying 1 event imported.  # goto the calendar    you should see a single event appearing on the first day but not on subsequent days",40,train
MDL-42081,EditPDF: Add default stamp images,we need to add the new default stamp images done by barbara in mdl 41856 (they are in the zip file),5,train
MDL-42082,Password field appears as text plain in the external database auth plugin form,"the external database auth plugin has fields to write the config to access to a external database. in other plugins and apps the password field use to be filled with asterisc or something, but not in this case.    the password field should have the attribute type as password, and not as text.",2,train
MDL-42085,Default Enrollment duration is not applied when manually enrolling a user if enrollment option is not expanded.,issue: enrollment duration is not applied when manually enrolling a user if enrollment option is not expanded.    steps to replicate:  go into a course  course admin>enrollment methods>manual enrollments>settings  set and enable a default enrollment duration  go to enrolled users  enroll users   just enrol a user  result:  no end date is applied to the user enrollment    to get the user enrollment duration applied:  go to enrolled users  click the enrollment options arrow to drop that menu down  make no changes to it (you will see the default is populated)  enrol user  finish enrolling users  end date is populated  ,5,train
MDL-42091,Fix the background color for atto buttons when clicked and hover,"they should be:    hover:  backgroundcolor: #ebebeb;  backgroundimage: radialgradient(ellipse at center, #ffffff 60%,#dfdfdf 100%);    active:  backgroundcolor: #dfdfdf;  backgroundimage: radialgradient(ellipse at center, #ffffff 40%,#dfdfdf 100%);",2,train
MDL-42097,can_change_password() set to false should not display the password form input during update,enable web service authentication plugin  create a new user set to ws auth method  try to change the password => no error. however the password change didn't occur because canchangepassword() is set to false.    we should not display the password field if the authentication method doesn't support a change   or display a warning message. the administrator could be thinking he did change the password. this could be considered as security issue even thought it's going to be rare.,8,train
MDL-42098,Debugging message only shown when alternate name fields are enabled.,if the alternate name fields are not used in moodle then the debugging message saying that there are missing fields will not be displayed.  the fullname function should be altered to show a debugging message regardless of whether the alternate fields are enabled or not.,8,train
MDL-42100,Bad links in Capability overview report,"steps to reproduce    # click site admin > users > permissions > capability overview  # select one or more capabilities  # select all roles  # click ""get the overview""  # click one of the role names in the table header.    what should happen    not sure, maybe the links should go to /admin/roles/allow.php?mode=override    what actually happens    the link goes to admin/roles/override.php?contextid=1&roleid=1    which gives this error:      cannot override base role capabilities    more information about this error    debug info:   error code: cannotoverridebaserole  stack trace:  line 463 of /lib/setuplib.php: moodleexception thrown  line 86 of /admin/roles/override.php: call to printerror()  ",2,train
MDL-42102,Style TinyMCE toolbars consistently with Moodle style,gray icons on gray background makes the icons look washed out. it would somehow improve the contrast by having white background instead.     please refer to mdl 41633 for the style,100,train
MDL-42110,Installing add-ons causes 500 internal server error.,when installing add ons using the functionality as described on http:/docs.moodle.org/25/en/admin/tool/installaddon/index it is possible that when the files are copied from the 'moodledata' folder to the moodle installation folder the wrong permissions are used thus causing a 500 internal server error on a unix / linux operating system when the plugin is used.    if a plugin is unzipped locally and ftp'd then the issue does not occur.    after extensive investigation (and from other sources) on: https:/moodle.org/mod/forum/discuss.php?d=238274.  i have discovered that the folders are being copied with a '777' permission and the files '666' and that manually correcting this recursively for folders to '755' and files to '644' rectifies the issue.    it might be that there is no actual code fix but rather improved instructions to set the permissions on the 'moodledata' folder as '755' for folders and '644' for files ensuring the owner and group are the same as the web server.,13,train
MDL-42111,Youtube Repository Video Preview is Cut Off,"when using ""insert moodle media"" to add a youtube video (from the youtube repository) to an html editor, the preview of the video is cut off and displays only as a very narrow vertical strip.  please see the attached screenshot.    note: this seems to be a problem only in the formal white, boxie, and brick themes.  the following themes display the video preview correctly: anomaly, arialist, binarius, formfactor, fusion, leatherbound and magazine.    steps to replicate:  # ensure youtube repository is enabled on site.  # ensure the site theme (or course theme) is one of the affected themes.   # access the text editor in any course assignment, label, etc.   # click ""insert moodle media"".   # click ""find or upload a sound, video or applet...""   # click on youtube repository and search for literally any youtube video.   # select the desired video; click ""select this file"".   # review the video in the ""insert moodle media"" box.   # for the affected themes, the video will be cut off and not display the entire video thumbnail.    expected result: the full width of the video is viewable in the preview window.    actual result: the video preview shows only a very narrow vertical strip.",8,train
MDL-42117,Drag and drop upload of resources breaks AJAX actions,"# in a course, as a teacher with editing on..  # drag and drop (file drag and drop) an image into a section and choose 'create a file resource'  # change the visibility to hidden  # attempt to do things with the resource just uploaded such as hide, move etc.    expected results:  all actions work as normal.    actual result:  the ajax breaks on those resources, the hidden icon isn't working and you can't move the resources.",13,train
MDL-42129,Create mock up for the filemanager to match the new toolbar,"filemanager should look consitent with the new toolbar (atto, editpdf, tinymce)    please refer to mdl 41633 for styling details",2,train
MDL-42130,Create mock up for the filepicker to match new toolbar,"filepicker should look consitent with the new toolbar (atto, editpdf, tinymce, filemanager)    please refer to mdl 41633 for styling details",2,train
MDL-42131,Edit PDF missing require_login on some pages.,ajax.php and testgs.php are missing requirelogin    also suggested by petr:  use require  not requireonce for config.php  and  thirdpartylibs.xml should be in the plugin  not in /lib        ,1,train
MDL-42144,Improve Dynamic Loading in Repository filepicker,"as discussed in mdl 41215, there are a couple of improvements we can make to the dynamic loading (infinite scroll) for the repository javascript to help improve performance.",2,train
MDL-42147,Filepicker:  aesthetic css issues on IE9,"standard and clean themes:   the picker content goes over the dialogue height. it's very subtle, look at the bottom of the dialog when changing repository. it's more obvious on clean. you can look on 2.4/2.5 for the good behavior, the full dialogue height is resized following the file picker content.    clean theme:   the header is blue    ""upload a file"" and ""url downloader"" icons are too big    i also attached a screenshot of a css glitch on 2.4/2.5 about the top rounded corners. i initially took this screenshot to show how the file picker on 2.6 should look on ie9. it's not the object of this issue, so if it's not easily fixable on the go, you can write a different issue. ",13,train
MDL-42149,Design new icons for filemanager/filepicker in svg/png format,design new icons to make it consistent with the rest of the new svg icons,20,train
MDL-42150,Edit PDF Ajax error saving pages.,errors saving pages.    ,1,train
MDL-42152,import YUI 3.13.0,"we have some nasty hacks in 3.12.0 at the moment, we should aim for 3.13.0 in 2.6 release...",5,train
MDL-42173,Name fields notices on registration page.,"while investigating mdl42138, i noticed that registration page is generating notices as below:  you need to update your sql to include additional name fields in the user object. line 3601 of /lib/moodlelib.php: call to debugging() line 65 of /login/signupform.php: call to fullname() line 191 of /lib/formslib.php: call to loginsignupform>definition() line 312 of /lib/authlib.php: call to moodleform>moodleform() line 50 of /login/signup.php: call to authpluginbase >signupform()  ",8,train
MDL-42195,Bootstrap makes all images responsive with no way to disable this behaviour via CSS,"after changing the dimensions of the image the image is still display with its original dimension.    this prevents setting a width/height on images in atto and tinymce, and has broken all sorts of images all over moodle.     bootstrap 3 reverted this behaviour to make it optin  but we are stuck with bootstrap 2.   ",13,train
MDL-42199,Random failures with test_increment_revision_number,in the ci servers we are getting random failures with testincrementrevisionnumber about some number not being incremented.    as far as the main goal of that code is to guarantee revision numbers to be incremented… it sounds like something to investigate to be 100% in the safe side.    example: http:/integration.moodle.org/job/20.%20run%20phpunit%20unittests%20(master)/1793/testreport/junit/(root)/coredatalibtestcase/testincrementrevisionnumber/    ciao : ),2,train
MDL-42201,Creating a course and running the cron causes 'Error' to be displayed in backup report.,"it was discussed with eloy that we would do the fix for mdl 37181, with the knowledge of this issue, and fix this here.    the solution is to create a new status for the backups when they are first created to something like 'waiting for first backup', rather than setting the status to the default (error).",8,train
MDL-42206,Don't trigger meta enrolment sync on course settings change,"when you save course settings, each enrol instances plugin execute their own ""courseupdated"" function.    on our plateform, it creates huge loads, especially for ""enrolmeta_plugin"".    we don't see why this function is executed because course settings page doesn't affect enrolments.    also, meta link http:/git.moodle.org/gw?p=moodle.git;a=blob;f=enrol/meta/lib.php;h=67420870391130d540003ec612cc31ab5259b821;hb=head#l120 got some comment about cohorts plugin. maybe a wrong copy/paste ?  ",2,train
MDL-42207,fix message text formatting,"the message formatting code is not ok, let's cleanup this area",8,train
MDL-42208,use unmasking password field in auth plugin configs (master) and prevent saving of passwords,"the problem is that auth config does not use forms yet, but i guess we can hack around it for now....",5,train
MDL-42212,Lesson module is not browseable using the Server Files repository,"when files are added to an activity, a folder is automatically created in server files>>system>>course with the name of the activity and the type of activity. this folder contains all the files added to the activity. this doesn't happen when adding files to a lesson activity.  steps to reproduce:  create a new course.  add a forum, database, quiz, and lesson activities.  add images to each activity using the html editor (i.e. insert/edit a link, insert/edit image). upload file from your local computer using the file picker.  once all the activities are created and images have been added. edit the forum description. click on insert/edit image>>find or upload and image. notice that the folder lesson does not appear in server files>>system>>course.",13,train
MDL-42214,Blocking user before reading message causes constant popups,i think this mdl 18386 is back (well it happens for me on moodle.org anyway).     ,8,train
MDL-42217,Course actionmenu is not toggled by coursebase setup_for_*,"as discussed in mdl 42117, we have an invocation system for when new modules are added (e.g. drag+drop). the actionmenu should ideally use this system rather than it's own.",4,train
MDL-42223,Deprecate $CFG->cachejs in favour of reusing $CFG->debug,"as a result of mdl41985, this has been suggested to reduce the number of options relating to  js. we currently have:     $cfg>cachejs   $cfg>jsrev   $cfg>debug    the proposal is to:   remove $cfg>cachejs; and   when $cfg>debug == debug_developer:    set $cfg>jsrev = 1",13,train
MDL-42224,clean up messaging and email redirection in unit tests,problems:   use of $cfg>noemailever in unit tests   badges is abusing $cfg>noemailever  fatal moodle_url attachment error is hidden by that   we should give better warnings in tests about redirection of emails and messages   we should not rely on $cfg>noemailever for prevention of sending messages from unit tests,5,train
MDL-42225,Badge recipients page warns about additional name fields missing,# create a badge.  # award this badge to a user.  # you will see the following issue on the page       you need to update your sql to include additional name fields in the user object.        line 3568 of /lib/moodlelib.php: call to debugging()      line 802 of /badges/renderer.php: call to fullname()      line 215 of /lib/outputrenderers.php: call to corebadgesrenderer>renderbadgerecipients()      line 104 of /badges/recipients.php: call to pluginrendererbase >render()  ,5,train
MDL-42226,Viewing an issued badge warns about additional name fields missing,# create a badge.  # award this badge to a user.  # on the next screen click on 'view issued badge'  # you will see the following warning         you need to update your sql to include additional name fields in the user object.        line 3568 of /lib/moodlelib.php: call to debugging()      line 319 of /badges/renderer.php: call to fullname()      line 215 of /lib/outputrenderers.php: call to corebadgesrenderer>renderissuedbadge()      line 64 of /badges/badge.php: call to pluginrendererbase >render()  ,5,train
MDL-42227,Funkiness with drag/drop, new course   turn editing on   add a cm to section 1   refresh the page (make sure we have a clean slate)   drag the new cm to section 2 (do not refresh)   drag the new cm to section 1 (do not refresh)    drag section 1 down (it tries to drag section 2),20,train
MDL-42235,Create outline on font colour and highlight icons for editors,"when the font colour and highlight colour are grey, the icon itself can be lost, so a white outline of the icon would be helpful",8,train
MDL-42236,Style the filemanager to match the new toolbar,please refer to this issue mdl42129 for the mockup,20,train
MDL-42237,Style the filepicker to match the new toolbar,please refer to this issue mdl 42130 for the mockup,20,train
MDL-42239,Calendar tooltips have bad aria-controls values,"on a course with the calendar block added and some events added, the ariacontrols value points to a nonexistant id.    the chrome accessibility audit points out the severe nature of this.",5,train
MDL-42241,The URL for the upload courses tool in site admin is wrong,"i have a test site at http:/localhost/moodle/int/master/    if i search for ""upload"" in the site admin search field i get a bunch of stuff back. for example ""upload users"" which points to http:/localhost/moodle/int/master/admin/tool/uploaduser/index.php (which is correct).    however, ""upload courses"" points to http:/localhost/admin/tool/uploadcourse/index.php which 404s. the url should be http:/localhost/moodle/int/master/admin/tool/uploadcourse/index.php",2,train
MDL-42243,filter settings regressions,the problem is we should support settings.php in filters but at the same time keep bc for filtersettings.php,2,train
MDL-42269,Review all new events introduced in 2.6dev,"events are not supposed to change between releases, we need to verify following:   event names are standardised   event structure is ok   there are tests for all events   events are trigger at the right places with correct parameters  ",40,train
MDL-42276,"Automate groups CRUD actions (MDLQA-2335, MDLQA-2238, MDLQA-2105, MDLQA-1813, MDLQA-1812)",there are multiple mdlqa that checks those basic group features. we can wrap them all in a single feature.    this issue should be backported to 2.5,20,train
MDL-42280,Automate MDLQA-1546 and MDLQA-1545 - blocks management,both features can be specified in a single blocks management feature file as they have parts in common and probably the initial context set up can be shared in a background section,8,train
MDL-42285,Automate MDLQA-93 - A teacher can delete questions from the question bank,"as described in mdlqa 93, a teacher can delete questions from the question bank",8,train
MDL-42289,Automate MDLQA-57 - Past chat sessions can be made available for everyone to view,"as described in mdlqa 57, past chat sessions can be made available for everyone to view",41,train
MDL-42292,block.version regression in custom lang tool,"debug info: error: column ""version"" does not exist  line 1: select version from mld998oblock where name = $1  ^  select version from mld998oblock where name = $1  [array (  0 => 'activitymodules',  )]  error code: dmlreadexception  stack trace:  line 442 of /lib/dml/moodledatabase.php: dmlreadexception thrown  line 239 of /lib/dml/pgsqlnativemoodledatabase.php: call to moodledatabase>queryend()  line 743 of /lib/dml/pgsqlnativemoodledatabase.php: call to pgsqlnativemoodledatabase>queryend()  line 1431 of /lib/dml/moodledatabase.php: call to pgsqlnativemoodledatabase>getrecordssql()  line 1504 of /lib/dml/moodledatabase.php: call to moodledatabase>getrecordsql()  line 1485 of /lib/dml/moodledatabase.php: call to moodledatabase>getfieldsql()  line 1464 of /lib/dml/moodledatabase.php: call to moodledatabase>getfieldselect()  line 297 of /lib/adminlib.php: call to moodledatabase >getfield()  line 98 of /admin/tool/customlang/locallib.php: call to getcomponentversion()  line 60 of /admin/tool/customlang/index.php: call to toolcustomlangutils::checkout()    ",1,train
MDL-42293,"Behat upload step, should be able to determine proper location if ""admin/"" is present in the url.","behat upload step, should be able to determine proper location if ""admin/"" is present in the url.",5,train
MDL-42317,TinyMCE editor can overlap with Blocks on New Event Page in Calendar in Clean Theme,see attached screenshot.    i thought this was a bug in essential at first.  tinymce is over too far to the right and usually overlaps with the blocks on the right.  this can be avoided with a really wide browser window in clean but not in essential.,20,train
MDL-42330,Automate MDLQA-5257 - An admin can award a site badge,"as mdlqa 5257 described, an admin can award a site badge",3,train
MDL-42331,Automate MDLQA-5258 - A teacher can add and allocate a course badge,"as described in mdlqa 5258, a teacher can add and allocate a course badge",3,train
MDL-42332,Automate MDLQA-5260 and MDLQA-5261 - A badge can be awarded based on activity and course completion.,"as described in mdlqa5060 and mdlqa5261, a badge can be awarded based on activity and course completion.    both can be joined in the same feature file using scenarios and a background section",5,train
MDL-42339,Remove double formatting set_title/set_heading over codebase,"both $page>settitle() and $page>setheading() already process the contents passed with formatstring(). so any call of this type:   $page>settitle(formatstring(… (there are 42 of this, at least)   $page>setheading(formatstring(… (there are 25 of this, at least)    context in formatstring() calls is only needed if it does not match current $page>context or if it has not been set. and any of these operations set it:     requirelogin() calls passing the 3rd, $cm parameter.   $page>setcm() calls.    $page >set_context() explicit calls.    this is about to search and destroy all those incorrect uses, looking to each carefully, ensuring that context is always set.",13,train
MDL-42340,Long help texts overflow in help tooltips,"# goto a course > add new badge. # make sure you are doing this from a local site, you should see a warning ""your site is not accessible from the internet, so any badges issued from this site cannot be verified by external backpack services."" with a help icon. # click on the help icon, the popup should render properly. screenshot: https:/tracker.moodle.org/secure/attachment/35202/bonfirescreenshot20131015103324979.png ",2,train
MDL-42342,Alternate name warnings in quiz results block,i noticed this error from course/view.php page with quizresults block displayed.    you need to update your sql to include additional name fields in the user object.        line 3568 of /lib/moodlelib.php: call to debugging()      line 407 of /blocks/quizresults/blockquizresults.php: call to fullname()      line 296 of /blocks/moodleblock.class.php: call to blockquizresults>getcontent()      line 238 of /blocks/moodleblock.class.php: call to blockbase>formattedcontents()      line 956 of /lib/blocklib.php: call to blockbase>getcontentforoutput()      line 1008 of /lib/blocklib.php: call to blockmanager>createblockcontents()      line 361 of /lib/outputrenderers.php: call to blockmanager>ensurecontentcreated()      line 45 of /theme/clean/layout/columns3.php: call to corerenderer>standardheadhtml()      line 866 of /lib/outputrenderers.php: call to include()      line 796 of /lib/outputrenderers.php: call to corerenderer>renderpagelayout()      line 244 of /course/view.php: call to corerenderer>header()    ,3,train
